tconst,originalTitle,year,genres,runtime,localised_title,averageRating,numVotes,overview,poster_path,production_countries,Actors,Directors,Writers,overview_fr
tt0065086,That Cold Day in the Park,1969,"Drama, Thriller",113,That Cold Day in the Park,7.0,2384,"Frances Austen, whose well-appointed apartment overlooks a park in Vancouver, one cold day, observes a rain-soaked young man on a park bench whom she assumes is homeless. Hoping to repress her loneliness, Frances invites ‘the boy’ inside her home to get warm and ends up encouraging him to stay. The young man accepts her every hospitality—food, clothes, profuse conversation, and a room of his own. Little does she realize that her guest is not the person he appears to be. Nor, for that matter, is Frances the woman that she appears to be.",/69hSN6FIwSNDZJqHElJejJ2EnI2.jpg,"US, CA","Susanne Benton, David Garfield, Sandy Dennis, Michael Burns, Rae Brown, Doris Buckinham, Frank Wade, Luana Anders, Alicia Ammon, Edward Greenhalgh",Robert Altman,"['Gillian Freeman', 'Peter Miles']","Frances Austen, dont l'appartement bien aménagé donne sur un parc de Vancouver, un jour froid, observe un jeune homme mouillé sur un banc de parc qu'elle assume sans abri. Espérant réprimer sa solitude, Frances invite «le garçon à l'intérieur de sa maison pour se réchauffer et finit par l'encourager à rester. Le jeune homme accepte son hospitalité – nourriture, vêtements, conversation abondante, et une pièce de sa propre. Elle ne se rend pas compte que son invité n'est pas la personne qu'il semble être."
tt0065088,"They Shoot Horses, Don't They?",1969,Drama,129,On achève bien les chevaux,7.8,21465,"In the midst of the Great Depression, manipulative emcee Rocky enlists contestants for a dance marathon offering a $1,500 cash prize. Among them are a failed actress, a middle-aged sailor, a delusional blonde and a pregnant girl.",/gzzJDBx66nTk60jhME5OwRAefQ0.jpg,US,"Susannah York, Bruce Dern, Bonnie Bedelia, Gig Young, Red Buttons, Michael Conrad, Jane Fonda, Robert Fields, Michael Sarrazin, Al Lewis",Sydney Pollack,"['Horace McCoy', 'Robert E. Thompson', 'James Poe']","Au milieu de la Grande Dépression, Rocky s'engage dans un marathon de danse offrant un prix en argent de 1 500 $. Parmi eux, une actrice ratée, un marin d'âge moyen, une blonde délirante et une fille enceinte."
tt0065126,True Grit,1969,"Adventure, Drama, Western",128,100 Dollars pour un shérif,7.4,52540,"The murder of her father sends a teenage tomboy on a mission of 'justice', which involves avenging her father's death. She recruits a tough old marshal, 'Rooster' Cogburn because he has 'true grit', and a reputation of getting the job done.",/lmexRC57l39elaIcnxhaHpcaIW2.jpg,US,"Jeff Corey, Alfred Ryder, Robert Duvall, Dennis Hopper, Jeremy Slate, Kim Darby, Strother Martin, John Wayne, Ron Soble, Glen Campbell",Henry Hathaway,"['Charles Portis', 'Marguerite Roberts']","Le meurtre de son père envoie un jeune garçon sur une mission de «justice», qui consiste à venger la mort de son père. Elle recrute un vieux marshal dur, «Rooster» Cogburn parce qu'il a «vraiment grit», et une réputation de faire le travail."
tt0065134,Two Mules for Sister Sara,1970,"Adventure, Romance, Drama",116,Sierra torride,7.0,31511,"When a wandering mercenary named Hogan rescues a nun called Sister Sara from the unwanted attentions of a band of rogues on the Mexican plains, he has no idea what he has let himself in for. Their chance encounter results in the blowing up of a train and a French garrison, as well as igniting a spark between them that survives a shocking discovery.",/2G9eM8UAM57TanLBhuPmz3jaNZG.jpg,"US, MX","Alberto Morin, David Povall, Pancho Córdova, John Kelly, Shirley MacLaine, José Chávez, Clint Eastwood, Armando Silvestre, Ada Carrasco, Manolo Fábregas",Don Siegel,"['Albert Maltz', 'Budd Boetticher']","Quand un mercenaire errant du nom d'Hogan sauve une religieuse appelée sœur Sara des attentions indésirables d'une bande de rogues dans les plaines mexicaines, il n'a aucune idée de ce qu'il s'est laissé faire. Leur rencontre par hasard a pour résultat l'explosion d'un train et d'une garnison française, ainsi que l'allumage d'une étincelle entre eux qui survit à une découverte choquante."
tt0065143,L'uccello dalle piume di cristallo,1970,"Horror, Thriller, Mystery",96,L'oiseau au plumage de cristal,7.1,25213,"An American writer living in Rome witnesses an attempted murder that is connected to an ongoing killing spree in the city, and conducts his own investigation despite himself and his girlfriend being targeted by the killer.",/dpALRkwodEIT7TGX9SqTgwVNn0i.jpg,"DE, IT","Renato Romano, Tony Musante, Gildo Di Marco, Umberto Raho, Pino Patti, Suzy Kendall, Mario Adorf, Eva Renzi, Giuseppe Castellano, Enrico Maria Salerno",Dario Argento,['Dario Argento'],"Un écrivain américain vivant à Rome est témoin d'une tentative de meurtre liée à un massacre en cours dans la ville, et mène sa propre enquête malgré lui-même et sa petite amie étant pris pour cible par le tueur."
tt0065152,Une femme douce,1969,"Romance, Drama",88,Une femme douce,7.3,3160,"When his young wife commits suicide with no explanation, an introspective pawnbroker looks back on their life together.",/lIH2qU6m25a7PBAm0AeEdAzRFSz.jpg,FR,"Jeanne Lobre, Dorothée Blanck, Guy Frangin, Jacques Kébadian, Dominique Sanda, Claude Ollier, Gilles Sandier",Robert Bresson,['Fyodor Dostoevsky'],"Quand sa jeune femme se suicide sans aucune explication, un prêteur sur gages introspectif revient sur leur vie ensemble."
tt0065207,Where Eagles Dare,1968,"Action, Adventure, War",158,Quand les aigles attaquent,7.6,64348,"World War II is raging, and an American general has been captured and is being held hostage in the Schloss Adler, a Bavarian castle that's nearly impossible to breach. It's up to a group of skilled Allied soldiers to liberate the general before it's too late.",/dnyiVS4Ad4w4rfS4Bm1YalEdonx.jpg,GB,"Richard Burton, William Squire, Robert Beatty, Patrick Wymark, Mary Ure, Donald Houston, Peter Barkworth, Brook Williams, Michael Hordern, Clint Eastwood",Brian G. Hutton,['Alistair MacLean'],"La Seconde Guerre mondiale fait rage, et un général américain a été capturé et est retenu en otage dans le Schloss Adler, un château bavarois qui est presque impossible à briser. Il revient à un groupe de soldats alliés compétents de libérer le général avant qu'il ne soit trop tard."
tt0065214,The Wild Bunch,1969,"Action, Adventure, Drama",135,La Horde sauvage,7.9,91946,"An aging group of outlaws look for one last big score as the ""traditional"" American West is disappearing around them.",/8j9yEC3xjy1PJDSizIbaxcHaSph.jpg,US,"Emilio Fernández, Ernest Borgnine, Ben Johnson, Edmond OBrien, Robert Ryan, Warren Oates, William Holden, Strother Martin, L.Q. Jones, Jaime Sánchez",Sam Peckinpah,"['Walon Green', 'Roy N. Sickner', 'Sam Peckinpah']",Un groupe de hors-la-loi vieillissant cherche un dernier gros score que l'Ouest américain « traditionnel » disparaît autour d'eux.
tt0065233,Yuke yuke nidome no shojo,1969,"Horror, Drama",65,Va Va vierge pour la deuxième fois,7.1,2748,"After being sexually assaulted on a rooftop, seventeen year old Poppo meets a mysterious boy, and swap their traumas and fears, with fatal consequences.",/821uWVYSpUaiNUTHTVenmt1YKJW.jpg,JP,"Michio Akiyama, Chôjamaru Fuga, Arisa Hanamura, Yûji Aoki, Yôko Yamamoto, Keikazu Hone, Rei Kagami, Madame Edward, Mimi Kozakura, Seshio Zenbei",Kôji Wakamatsu,"['Masao Adachi', ""Kazuo 'Gaira' Komizu""]","Après avoir été agressé sexuellement sur un toit, Poppo, dix-sept ans, rencontre un garçon mystérieux et échange ses traumatismes et ses craintes, avec des conséquences fatales."
tt0065234,Z,1969,"Thriller, Drama, Crime",127,Z,8.1,32156,"Amidst a heated political climate, the opposition leader is killed in what appears to be a traffic accident. When a magistrate finds evidence of a government cover-up, witnesses start to get targeted. A thinly-fictionalized account of the events surrounding the assassination of Greek politician Grigoris Lambrakis in 1963, Z captures the outrage about the military junta that ruled Greece at the time.",/dFAJyFNgvOv24f2RQyI9KDxjGr3.jpg,"FR, DZ","Jacques Perrin, Pierre Dux, Bernard Fresson, Marcel Bozzuffi, François Périer, Charles Denner, Yves Montand, Jean-Louis Trintignant, Georges Géret, Irene Papas",Costa-Gavras,"['Jorge Semprún', 'Vassilis Vassilikos']","Au milieu d'un climat politique houleux, le chef de l'opposition est tué dans ce qui semble être un accident de la circulation. Lorsqu'un magistrat trouve des preuves d'une dissimulation du gouvernement, des témoins commencent à se faire prendre pour cible."
tt0065417,Aranyer Din Ratri,1970,Drama,115,Des jours et des nuits dans la forêt,8.1,2994,"Four friends from Calcutta who have very different personalities make a holiday excursion into the country, to a tiny village in the state of Bihar where they set themselves up in a bungalow. A series of minor events, all connected to their respective reactions to their new environment, reveals their characters more deeply.",/lkaPfN95q8aaO8c0jUR6ytUhcwd.jpg,IN,"Premashish Sen, Rabi Ghosh, Subhendu Chatterjee, Sharmila Tagore, Pahadi Sanyal, Simi Garewal, Kaberi Bose, Samit Bhanja, Samar Nag, Soumitra Chatterjee",Satyajit Ray,"['Satyajit Ray', 'Sunil Gangopadhyay']","Quatre amis de Calcutta qui ont des personnalités très différentes font une excursion de vacances dans le pays, dans un petit village dans l'état de Bihar où ils s'installent dans un bungalow. Une série d'événements mineurs, tous liés à leurs réactions respectives à leur nouvel environnement, révèle plus profondément leurs personnages."
tt0065421,The AristoCats,1970,"Adventure, Comedy, Animation",78,Les Aristochats,7.1,117851,"When Madame Adelaide Bonfamille leaves her fortune to Duchess and her children—Bonfamille’s beloved family of cats—the butler plots to steal the money and kidnaps the legatees, leaving them out on a country road. All seems lost until the wily Thomas O’Malley Cat and his jazz-playing alley cats come to the aristocats’ rescue.",/7GVekZRvV25OzUQIw1Gn4sikkVo.jpg,US,"Eva Gabor, Dean Clark, Phil Harris, Scatman Crothers, Thurl Ravenscroft, Paul Winchell, Lord Tim Hudson, Vito Scotti, Sterling Holloway, Liz English",Wolfgang Reitherman,"['Ken Anderson', 'Vance Gerry', 'Larry Clemmons', 'Frank Thomas']","Quand Madame Adelaide Bonfamille laisse sa fortune à Duchess et à ses enfants – la famille bien-aimée de chats – le majordome complote pour voler l'argent et enlève les légataires, les laissant sur une route de campagne. Tout semble perdu jusqu'à ce que le wily Thomas O-Malley Cat et ses chats de l'allée jazz-playing viennent à la rescousse aristocats."
tt0065439,L'aveu,1970,"Drama, Thriller",139,L'aveu,7.8,4949,"The vice-minister of Foreign Affairs of Czechoslovakia, knowing he's being watched and followed, is one day arrested and put into solitary confinement by his blackmailers.",/boVQ8Qom5MoumDlHxQ9XwIh1wch.jpg,"IT, FR","Guy Mairesse, Gérard Darrieu, Monique Chaumette, Jean Bouise, Michel Vitold, Marc Eyraud, Yves Montand, Gabriele Ferzetti, Simone Signoret, László Szabó",Costa-Gavras,"['Artur London', 'Jorge Semprún', 'Lise London']","Le vice-ministre des Affaires étrangères de la Tchécoslovaquie, sachant qu'il est surveillé et suivi, est un jour arrêté et mis au secret par ses chantagiers."
tt0065446,The Ballad of Cable Hogue,1970,"Drama, Romance, Comedy",121,Un nommé Cable Hogue,7.2,10780,"Double-crossed and left without water in the desert, Cable Hogue is saved when he finds a spring. It is in just the right spot for a much needed rest stop on the local stagecoach line, and Hogue uses this to his advantage. He builds a house and makes money off the stagecoach passengers. Hildy, a prostitute from the nearest town, moves in with him. Hogue has everything going his way until the advent of the automobile ends the era of the stagecoach.",/bEth8XAYaytjzxnHkLkj4nZx2XD.jpg,US,"Gene Evans, Jason Robards, Slim Pickens, R.G. Armstrong, Peter Whitney, Strother Martin, L.Q. Jones, William Mims, David Warner, Stella Stevens",Sam Peckinpah,"['John Crawford', 'Edmund Penney']","Double-croisé et laissé sans eau dans le désert, Cable Hogue est sauvé quand il trouve une source. Il est juste au bon endroit pour un arrêt de repos très nécessaire sur la ligne de diligence locale, et Hogue l'utilise à son avantage. Il construit une maison et fait de l'argent des passagers de diligence. Hildy, une prostituée de la ville la plus proche, emménage avec lui. Hogue a tout son chemin jusqu'à l'avènement de l'automobile termine l'ère de l' diligence."
tt0065488,The Boys in the Band,1970,Drama,120,Les Garçons de la Bande,7.6,6125,"A witty, perceptive and devastating look at the personal agendas and suppressed revelations swirling among a group of gay men in Manhattan. Harold is celebrating a birthday, and his friend Michael has drafted some other friends to help commemorate the event. As the evening progresses, the alcohol flows, the knives come out, and Michael's demand that the group participate in a devious telephone game, unleashing dormant and unspoken emotions.",/67MSQLBQeASxJycoY25hc3hxynb.jpg,US,"Laurence Luckinbill, Maud Adams, Peter White, Kenneth Nelson, Reuben Greene, Leonard Frey, Keith Prentice, Frederick Combs, Robert La Tourneaux, Cliff Gorman",William Friedkin,['Mart Crowley'],"Harold célèbre un anniversaire, et son ami Michael a rédigé d'autres amis pour aider à commémorer l'événement. Au fur et à mesure que la soirée progresse, l'alcool coule, les couteaux sortent, et Michael demande que le groupe participe à un jeu téléphonique dérisoire, libérant des émotions dormantes et non parlées."
tt0065489,Brancaleone alle Crociate,1970,"Fantasy, Adventure, History",116,Brancaleone,7.2,2047,"After saving an infant of royal blood, knight Brancaleone forms a new army and sets out to return the baby to his father: a prince fighting in the Crusades.",/7iML7nTQ7uZTaZQlkZwdNcCLLm5.jpg,"IT, DZ","Sandro Dori, Augusto Mastrantoni, Paolo Villaggio, Vittorio Gassman, Lino Toffolo, Adolfo Celi, Gianrico Tedeschi, Renzo Marignano, Gigi Proietti, Beba Loncar",Mario Monicelli,"['Agenore Incrocci', 'Mario Monicelli', 'Furio Scarpelli']","Après avoir sauvé un enfant de sang royal, le chevalier Brancaleone forme une nouvelle armée et s'apprête à rendre le bébé à son père : un prince qui se bat dans les croisades."
tt0065528,Catch-22,1970,"Drama, Comedy, War",122,Catch-22,7.1,27065,"A bombardier in World War II tries desperately to escape the insanity of the war. However, sometimes insanity is the only sane way to cope with a crazy situation.",/eSB3i3vvFiRTszmZVawWqROzM6p.jpg,US,"Richard Benjamin, Buck Henry, Martin Sheen, Art Garfunkel, Alan Arkin, Martin Balsam, Jack Gilford, Anthony Perkins, Paula Prentiss, Bob Newhart",Mike Nichols,"['Buck Henry', 'Joseph Heller']","Un bombardier de la Seconde Guerre mondiale essaie désespérément d'échapper à la folie de la guerre. Cependant, parfois la folie est la seule façon saine de faire face à une situation folle."
tt0065531,Le cercle rouge,1970,"Thriller, Drama, Crime",140,Le cercle rouge,7.9,29589,"When French criminal Corey gets released from prison, he resolves to never return. He is quickly pulled back into the underworld, however, after a chance encounter with escaped murderer Vogel. Along with former policeman and current alcoholic Jansen, they plot an intricate jewel heist. All the while, quirky Police Commissioner Mattei, who was the one to lose custody of Vogel, is determined to find him.",/w56La43IJnGpLepgqfGCAZsbQPp.jpg,"IT, FR","Pierre Collet, Paul Amiot, Jean-Pierre Posier, Paul Crauchet, André Ekyan, Bourvil, Gian Maria Volontè, Yves Montand, Alain Delon, François Périer",Jean-Pierre Melville,['Jean-Pierre Melville'],"Quand le criminel français Corey est libéré de prison, il décide de ne jamais revenir. Il est rapidement ramené dans le monde souterrain, cependant, après une rencontre de hasard avec le meurtrier évadé Vogel. Avec l'ancien policier et actuel alcoolique Jansen, ils complotent un braquage de bijoux complexe. Pendant tout ce temps, le commissaire de police Mattei, qui était celui à perdre la garde de Vogel, est déterminé à le trouver."
tt0065571,Il conformista,1970,Drama,113,Le conformiste,7.9,35112,"A weak-willed Italian man becomes a fascist flunky who goes abroad to arrange the assassination of his old teacher, now a political dissident.",/4GNljod7zSzjQSlPmSThWUy25Vr.jpg,"DE, FR, IT","Enzo Tarascio, Gastone Moschin, Stefania Sandrelli, Milly, Antonio Maestri, Alessandro Haber, Fosco Giachetti, José Quaglio, Yvonne Sanson, Jean-Louis Trintignant",Bernardo Bertolucci,"['Bernardo Bertolucci', 'Alberto Moravia']","Un Italien à volonté faible devient un fasciste qui se rend à l'étranger pour organiser l'assassinat de son ancien professeur, aujourd'hui dissident politique."
tt0065593,Cromwell,1970,"History, Biography, Drama",139,Cromwell,7.0,7312,"Disgusted with the policies of King Charles I, Oliver Cromwell plans to take his family to the New World. But on the eve of their departure, Cromwell is drawn into the tangled web of religion and politics that will result in the English Civil War.",/1qlnKlQGEdRl70KDpAv03F8uGzI.jpg,GB,"Charles Gray, Patrick Magee, Dorothy Tutin, Nigel Stock, Alec Guinness, Frank Finlay, Timothy Dalton, Patrick Wymark, Robert Morley, Richard Harris",Ken Hughes,['Ken Hughes'],"Détesté par la politique du roi Charles Ier, Oliver Cromwell projette d'emmener sa famille dans le Nouveau Monde. Mais à la veille de leur départ, Cromwell est attiré dans le réseau enchevêtré de la religion et de la politique qui aboutira à la guerre civile anglaise."
tt0065622,Il Decameron,1971,"History, Drama, Comedy",111,Le Décaméron,7.0,12694,"A young Sicilian is swindled twice, but ends up rich; a man poses as a deaf-mute in a convent of curious nuns; a woman must hide her lover when her husband comes home early; a scoundrel fools a priest on his deathbed; three brothers take revenge on their sister's lover; a young girl sleeps on the roof to meet her boyfriend at night; a group of painters wait for inspiration; a crafty priest attempts to seduce his friend's wife; and two friends make a pact to find out what happens after death.",/iL5mmuIL6fqFSWJeHE417WWrocz.jpg,"DE, FR, IT","Angela Luce, Giuseppe Zigaina, Ninetto Davoli, Franco Citti, Vincenzo Amato, Giorgio Iovine, Maria Gabriella Maione, Vincenzo Cristo, Pier Paolo Pasolini, Jovan Jovanovic",Pier Paolo Pasolini,"['Pier Paolo Pasolini', 'Giovanni Boccaccio']","Un jeune Sicilien est escroqué deux fois, mais finit riche; un homme se pose comme sourd-muet dans un couvent de sœurs curieuses; une femme doit cacher son amant quand son mari rentre tôt à la maison; un scélérat trompe un prêtre sur son lit de mort; trois frères se venger de l'amant de leur sœur; une jeune fille dort sur le toit pour rencontrer son petit ami la nuit; un groupe de peintres attendent l'inspiration; un prêtre rusé tente de séduire la femme de son ami; et deux amis font un pacte pour découvrir ce qui se passe après la mort."
tt0065636,Diary of a Mad Housewife,1970,"Drama, Comedy",95,Le Journal intime d'une femme mariée,7.0,2375,"Tina Balser is a bored New York housewife-mother married to Jonathan, a pompous, social-climbing lawyer who ridicules her in front of their children, criticizing everything she does or wears. She begins an affair with George Prager, a dashing, successful, and blatantly sadistic writer.",/loZFqYvqqzAhehLcbZq6djNo0JA.jpg,US,"Richard Benjamin, Peter Dohanos, Lee Addoms, Frannie Michel, Katherine Meskill, Lorraine Cullen, Valma, Frank Langella, Leonard Elliott, Carrie Snodgress",Frank Perry,"['Sue Kaufman', 'Eleanor Perry']","Tina Balser est une ennuyeuse femme au foyer new-yorkaise mariée à Jonathan, une avocate pompeuse et sociale qui la moque devant leurs enfants, critiquant tout ce qu'elle fait ou porte. Elle commence une liaison avec George Prager, un écrivain effronté, réussi et sadique."
tt0065649,Dodesukaden,1970,Drama,140,Dodeskaden,7.3,7838,"This film follows the daily lives of a group of people barely scraping by in a slum on the outskirts of Tokyo. Yet as desperate as their circumstances are, each of them—the homeless father and son envisioning their dream house; the young woman abused by her uncle; the boy who imagines himself a trolley conductor—finds reasons to carry on.",/gP9pM94ATcZGfKQ3faKy0a3dVIi.jpg,JP,"Shinsuke Minami, Yoshitaka Zushi, Keiji Furuyama, Yûko Kusunoki, Kiyoko Tange, Tappei Shimokawa, Kin Sugai, Junzaburô Ban, Toshiyuki Tonomura, Michio Hino",Akira Kurosawa,"['Shinobu Hashimoto', 'Hideo Oguni', 'Shûgorô Yamamoto', 'Akira Kurosawa']","Ce film fait suite à la vie quotidienne d'un groupe de personnes à peine éraflant dans un bidonville à la périphérie de Tokyo. Pourtant, aussi désespérés que soient leurs circonstances, chacun d'eux – le père et le fils sans abri envisageant leur maison de rêve ; la jeune femme abusée par son oncle ; le garçon qui s'imagine conducteur de chariot – trouve des raisons de continuer."
tt0065651,Domicile conjugal,1970,"Drama, Romance, Comedy",97,Domicile conjugal,7.4,10913,"Parisian everyman Antoine Doinel has married his sweetheart Christine Darbon, and the newlyweds have set up a cozy domestic life of selling flowers and giving violin lessons while Antoine fitfully works on his long-gestating novel. As Christine becomes pregnant with the couple's first child, Antoine finds himself enraptured with a young Japanese beauty. The complications change the course of their relationship forever.",/s9R5wKbrB9SfOG1FzbICbOsssX8.jpg,"IT, FR","Silvana Blasi, Daniel Ceccaldi, Hiroko Berghauer, Daniel Boulanger, Claude Jade, Pierre Maguelon, Danièle Girard, Jean-Pierre Léaud, Barbara Laage, Claire Duhamel",François Truffaut,"['François Truffaut', 'Bernard Revon', 'Claude de Givray']","Tous les parisiens Antoine Doinel a épousé sa chérie Christine Darbon, et les jeunes mariés ont mis en place une vie domestique cosy de vente de fleurs et de cours de violon pendant qu'Antoine travaille correctement sur son long-géant roman. Alors que Christine devient enceinte du premier enfant du couple, Antoine se retrouve enrôlé d'une jeune beauté japonaise. Les complications changent le cours de leur relation pour toujours."
tt0065662,Dramma della gelosia (tutti i particolari in cronaca),1970,"Drama, Romance, Comedy",99,Drame de la jalousie,7.1,2443,"Construction worker Oreste and young fiancee Adelaide meet Nello, cook in a pizzeria. This love triangle often go to communist rallies, and enjoy the filthy beach of Ostia. Will the hostile environment leave a way to jealousy?",/A8bdxnXRtNFKtQqiLEeEKoTLM0Z.jpg,IT,"Bruno Scipioni, Marcello Mastroianni, Fernando Sánchez Polack, Gioia Desideri, Juan Diego, Manuel Zarzo, Giancarlo Giannini, Marisa Merlini, Monica Vitti, Hércules Cortés",Ettore Scola,"['Agenore Incrocci', 'Ettore Scola', 'Furio Scarpelli']","Ouvrier de construction Oreste et jeune fiancée Adelaide rencontre Nello, cuisine dans une pizzeria. Ce triangle d'amour va souvent aux rassemblements communistes, et profiter de la plage sale d'Ostia. L'environnement hostile laissera-t-il un chemin à la jalousie?"
tt0065670,12 stulev,1971,"Adventure, Comedy, Crime",153,Les douze heures,8.2,7525,A former aristocrat Ippolit Vorobyaninov leads a miserable life in Soviet Russia. His mother-in-law reveals a secret to him - she hid family diamonds in one of the twelve chairs they once had. Vorobyaninov in cooperation with a young con artist Ostap Bender start a long search for the diamonds.,/fVzfgLPgrEOti2svUqwyLCtIeML.jpg,SU,"Sergey Filippov, Glikeriya Bogdanova-Chesnokova, Klara Rumyanova, Mikhail Pugovkin, Natalya Varley, Nina Grebeshkova, Natalya Krachkovskaya, Archil Gomiashvili, Georgiy Vitsin, Natalya Vorobyova",Leonid Gaidai,"['Yevgeni Petrov', 'Leonid Gaidai', 'Ilya Ilf', 'Vladlen Bakhnov']",Une ancienne aristocrate Ippolit Vorobyaninov mène une vie misérable en Russie soviétique. Sa belle-mère lui révèle un secret - elle a caché les diamants de la famille dans l'une des douze chaises qu'ils avaient autrefois. Vorobyaninov en coopération avec un jeune escroc Ostap Bender commencer une longue recherche des diamants.
tt0065695,L'enfance nue,1968,Drama,83,L'enfance - nue,7.4,2753,"Handed over to foster care by his mother—who's unwilling to give up permanent custody—the now-adolescent François understands that nothing in life is permanent, and his increasingly erratic actions reflect this knowledge.",/2cD6WpamMeCdMoinljqnj5c6YrF.jpg,FR,"Raoul Billerey, Michel Terrazon, Linda Gutenberg, Maurice Coussonneau, Marie Marc, Marie-Louise Thierry, René Thierry, Henri Puff, Pierrette Deplanque",Maurice Pialat,"['Arlette Langmann', 'Maurice Pialat']","Renvoyé à la famille d'accueil par sa mère, qui n'est pas disposée à abandonner la garde permanente, François, maintenant adolescent, comprend que rien dans la vie n'est permanent, et ses actions de plus en plus erratiques reflètent cette connaissance."
