tconst,originalTitle,year,genres,runtime,localised_title,averageRating,numVotes,overview,poster_path,production_countries,Actors,Directors,Writers,overview_fr
tt0071334,Claudine,1974,"Drama, Romance, Comedy",92,Claudine,7.3,2658,"Claudine is a single mother in New York City who endures an exhausting commute to the suburbs where she works as a maid for wealthy families. In one carefully tended white community, she meets Roop, a charismatic but irresponsible garbage collector. Romance quickly ensues, but Claudine doubts that their relationship is good for her six children, and Rupert, despite his good nature, is reluctant to take on fatherhood.",/9mLM4Vx0L5kjaHPFXSe3ZgBEBCx.jpg,US,"Socorro Stephens, Tamu Blackwell, James Earl Jones, David Kruger, Diahann Carroll, Lawrence Hilton-Jacobs, Eric Jones, C. Harrison Avery, Yvette Curtis, Adam Wade",John Berry,"['Lester Pine', 'Tina Pine']","Claudine est une mère célibataire à New York qui endure un trajet épuisant vers la banlieue où elle travaille comme servante pour les familles riches. Dans une communauté blanche soignée, elle rencontre Roop, un collectionneur charismatique mais irresponsable. Romance s'en suit rapidement, mais Claudine doute que leur relation soit bonne pour ses six enfants, et Rupert, malgré sa bonne nature, hésite à prendre la paternité."
tt0071358,Conrack,1974,Drama,106,Conrack,7.3,2334,"A young, white school teacher is assigned to Yamacraw Island, an isolated fishing community off the coast of South Carolina, populated mostly by poor black families. He finds that the basically illiterate, neglected children there know so little of the world outside their island.",/wiP6lRKlF4jngcH4yQZINWqqaUh.jpg,US,"Madge Sinclair, Jon Voight, Antonio Fargas, C.P. MacDonald, Gracia Lee, James ORear, Tina Andrews, Jane Moreland, Ruth Attaway, Paul Winfield",Martin Ritt,"['Pat Conroy', 'Irving Ravetch', 'Harriet Frank Jr.']","Un jeune enseignant de l'école blanche est affecté à Yamacraw Island, une communauté de pêcheurs isolée au large des côtes de la Caroline du Sud, peuplée principalement de familles noires pauvres. Il constate que les enfants fondamentalement analphabètes et négligés là-bas connaissent si peu du monde à l'extérieur de leur île."
tt0071360,The Conversation,1974,"Thriller, Drama, Mystery",113,Conversation secrète,7.7,126005,"Surveillance expert Harry Caul is hired by a mysterious client's brusque aide to tail a young couple. Tracking the pair through San Francisco's Union Square, Caul and his associate Stan manage to record a cryptic conversation between them. Tormented by memories of a previous case that ended badly, Caul becomes obsessed with the resulting tape, trying to determine if the couple is in danger.",/9LGN30PhmzAZhDc23yFBZAHtNST.jpg,US,"Teri Garr, Cindy Williams, Gene Hackman, Harrison Ford, Michael Higgins, Mark Wheeler, Allen Garfield, Elizabeth MacRae, John Cazale, Frederic Forrest",Francis Ford Coppola,['Francis Ford Coppola'],"Harry Caul, expert en surveillance, est engagé par l'aide d'un mystérieux client pour suivre un jeune couple. Après avoir suivi le couple à travers Union Square de San Francisco, Caul et son associé Stan parviennent à enregistrer une conversation cryptique entre eux. Tormenté par les souvenirs d'un cas précédent qui s'est mal terminé, Caul devient obsédé par la bande résultante, essayant de déterminer si le couple est en danger."
tt0071381,Céline et Julie vont en bateau: Phantom Ladies Over Paris,1974,"Fantasy, Drama, Comedy",193,Céline et Julie vont en bateau,7.2,6592,A mysteriously linked pair of young women find their daily lives pre-empted by a strange boudoir melodrama that plays itself out in a hallucinatory parallel reality.,/k5mxWTtahpqDDqwUbxsyYiKzTaf.jpg,FR,"Dominique Labourier, Anne Zamire, Bulle Ogier, Philippe Clévenot, Jean Douchet, Nathalie Asnar, Juliet Berto, Barbet Schroeder, Marie-Thérèse Saussure, Marie-France Pisier",Jacques Rivette,"['Dominique Labourier', 'Marie-France Pisier', 'Bulle Ogier', 'Juliet Berto']",Une paire mystérieusement liée de jeunes femmes trouvent leur vie quotidienne préemptée par un mélodrame boudoir étrange qui se joue dans une réalité parallèle hallucinatoire.
tt0071384,Daguerréotypes,1975,Documentary,78,Daguerreotypes,7.6,2089,"An intimate portrait of the small shops and shopkeepers of the Rue Daguerre in Paris, a picturesque street that has been the filmmaker’s home for more than 50 years.",/3XXWWVKbePGBu6Q7e0ngve5cwBB.jpg,"DE, FR",Robert François,Agnès Varda,['Agnès Varda'],"Un portrait intime des petits magasins et commerçants de la rue Daguerre à Paris, une rue pittoresque qui est la maison du cinéaste depuis plus de 50 ans."
tt0071406,Den-en ni shisu,1974,"Fantasy, Drama",104,Cache-cache pastoral,7.7,2543,"A young boys' coming of age tale set in a strange, carnivalesque village becomes the recreation of a memory that the director has twenty years later.",/ttWhroijTMTc81SvyqtSYWEbrYV.jpg,JP,"Masako Ono, Masumi Harukawa, Chigusa Takayama, Kantarô Suga, Kan Mikami, Keiko Niitaka, Salvador Tari, Masahiro Saito, Kaoru Yachigusa, Hiroyuki Takano",Shûji Terayama,['Shûji Terayama'],L'arrivée d'un conte de jeunes garçons dans un étrange village carnavalesque devient la récréation d'un souvenir que le réalisateur a vingt ans plus tard.
tt0071411,Dersu Uzala,1975,"Adventure, Biography, Drama",142,L'aigle de la Taiga,8.2,34387,"A military explorer meets and befriends a Goldi man in Russia’s unmapped forests. A deep and abiding bond evolves between the two men, one civilized in the usual sense, the other at home in the glacial Siberian woods.",/8r3TrVfbPyCIPHKm82EufPqlnIC.jpg,"SU, JP","Igor Sykhra, Vladimir Khlestov, Stanislav Marin, Maksim Munzuk, Vladimir Sergiyakov, Yuriy Solomin, Mikhail Bychkov, V. Lastochkin, Yanis Yakobsons, Vladimir Khrulyov",Akira Kurosawa,"['Yuriy Nagibin', 'Vladimir Arsenev', 'Akira Kurosawa']","Un explorateur militaire rencontre et se fait l'ami d'un Goldi en Russie. Un lien profond et constant évolue entre les deux hommes, l'un civilisé dans le sens habituel, l'autre chez lui dans les bois glaciaires sibériens."
tt0071486,Fantozzi,1975,Comedy,108,Fantozzi,7.8,7216,"A good-natured but unlucky Italian is constantly going on a difficult situations, but never lose his mood.",/7RUzOGm3juTEFLcpk91r5NvhcyN.jpg,IT,"Umberto DOrsi, Paolo Villaggio, Paolo Paoloni, Plinio Fernando, Elena Tricoli, Liù Bosisio, Dino Emanuelli, Anna Mazzamauro, Gigi Reder, Giuseppe Anatrelli",Luciano Salce,"['Piero De Bernardi', 'Luciano Salce', 'Paolo Villaggio', 'Leonardo Benvenuti']","Un Italien bon, mais malchanceux, se trouve constamment dans des situations difficiles, mais ne perd jamais son humeur."
tt0071487,Le fantôme de la liberté,1974,Comedy,104,Le fantôme de la liberté,7.8,17535,"This Surrealist film, with a title referencing the Communist Manifesto, strings together short incidents based on the life of director Luis Buñuel. Presented as chance encounters, these loosely related, intersecting situations, all without a consistent protagonist, reach from the 19th century to the 1970s. Touching briefly on subjects such as execution, pedophilia, incest, and sex, the film features an array of characters, including a sick father and incompetent police officers.",/f6cON5ebistPm6AS1XcZZMmKpIi.jpg,"IT, FR","Paul Frankeur, François Maistre, Jean-Claude Brialy, Julien Bertheau, Michael Lonsdale, Michel Piccoli, Adolfo Celi, Adriana Asti, Pierre Maguelon, Monica Vitti",Luis Buñuel,"['Luis Buñuel', 'Jean-Claude Carrière']","Ce film surréaliste, avec un titre faisant référence au Manifeste communiste, rassemble de courts incidents basés sur la vie du réalisateur Luis Buñuel. Présentés comme rencontres de hasard, ces situations étroitement liées, intersectueuses, toutes sans protagoniste cohérent, atteignent du 19ème siècle aux années 1970. Touchant brièvement sur des sujets tels que l'exécution, la pédophilie, l'inceste et le sexe, le film présente une série de personnages, dont un père malade et des policiers incompétents."
tt0071524,The Front Page,1974,"Drama, Romance, Comedy",105,Spéciale première,7.3,15790,A journalist suffering from burn-out wants to finally say goodbye to his office – but his boss doesn’t like the idea one bit.,/3kUbSnIq5k28eobX9HxSVldmJub.jpg,US,"Charles Durning, Jack Lemmon, Austin Pendleton, Susan Sarandon, Martin Gabel, Allen Garfield, Vincent Gardenia, Walter Matthau, Herb Edelman, David Wayne",Billy Wilder,"['I.A.L. Diamond', 'Ben Hecht', 'Billy Wilder', 'Charles MacArthur']",Un journaliste qui souffre d'épuisement veut enfin dire au revoir à son bureau – mais son patron n'aime pas un peu l'idée.
tt0071532,The Gambler,1974,"Drama, Crime",111,Le flambeur,7.1,6750,New York City English professor Axel Freed outwardly seems like an upstanding citizen. But privately Freed is in the clutches of a severe gambling addiction that threatens to destroy him.,/wyZyUHOm14wmStWnuBjflOkzajt.jpg,US,"Morris Carnovsky, Carmine Caridi, Jacqueline Brookes, Paul Sorvino, Lauren Hutton, London Lee, James Caan, Vic Tayback, Burt Young, Steven Keats",Karel Reisz,['James Toback'],"Le professeur d'anglais Axel Freed, de New York, a l'air d'un honnête citoyen, mais le privé Freed est aux prises avec une forte dépendance au jeu qui menace de le détruire."
tt0071562,The Godfather Part II,1974,"Drama, Crime",202,"Le Parrain, 2ème partie",9.0,1401016,"In the continuing saga of the Corleone crime family, a young Vito Corleone grows up in Sicily and in 1910s New York. In the 1950s, Michael Corleone attempts to expand the family business into Las Vegas, Hollywood and Cuba.",/hek3koDUyRQk7FIhPXsa6mT2Zc3.jpg,US,"Lee Strasberg, Robert Duvall, G.D. Spradlin, Michael V. Gazzo, Al Pacino, Robert De Niro, John Cazale, Talia Shire, Richard Bright, Diane Keaton",Francis Ford Coppola,"['Mario Puzo', 'Francis Ford Coppola']","Dans la saga continue de la famille criminelle Corleone, un jeune Vito Corleone grandit en Sicile et dans les années 1910 New York. Dans les années 1950, Michael Corleone tente d'étendre l'entreprise familiale à Las Vegas, Hollywood et Cuba."
tt0071585,Gruppo di famiglia in un interno,1974,"Romance, Drama",121,Les Feux de l'hiver,7.4,5364,"A retired professor of American origin lives a solitary life in a luxurious palazzo in Rome. He is confronted by a vulgar Italian marchesa and her lover, her daughter and her daughter's boyfriend, and forced to rent to them an apartment on the upper floor of his palazzo. From this point on his quiet routine is turned into chaos by his tenants' machinations, and everybody's life takes an unexpected but inevitable turn.",/vLFdB2MsgAH7UCVb60EzLTjIoqN.jpg,"IT, FR","Philippe Hersent, Umberto Raho, Guy Tréjan, Stefano Patrizi, Elvira Cortese, Jean-Pierre Zola, Burt Lancaster, Helmut Berger, Silvana Mangano, Claudia Marsani",Luchino Visconti,"['Luchino Visconti', ""Suso Cecchi D'Amico"", 'Enrico Medioli']","Un professeur à la retraite d'origine américaine vit une vie solitaire dans un palazzo luxueux à Rome. Il est confronté à une marche italienne vulgaire et à son amant, sa fille et le petit ami de sa fille, et forcé de leur louer un appartement à l'étage supérieur de son palazzo. À partir de ce moment sur sa routine tranquille est transformé en chaos par les machinations de ses locataires, et la vie de tout le monde prend un tour inattendu mais inévitable."
tt0071598,Harry and Tonto,1974,"Adventure, Comedy, Drama",115,Harry et Tonto,7.3,6396,"Harry is a retired teacher in his 70s living in the Upper West Side of New York City where his late wife and he raised his children--where he's lived all his life. When the building he lives in is torn down to make way for a parking garage, Harry and his beloved cat Tonto begin a journey across the United States, visiting his children, seeing a world he never seemed to have the time to see before, making new friends, and saying goodbye to old friends.",/69e3FajzDJ9bJsgxMAUrM9fGZgL.jpg,US,"Herbert Berghof, Avon Long, Michael McCleery, Cliff De Young, Art Carney, Ellen Burstyn, René Enríquez, Rashel Novikoff, Josh Mostel, Philip Bruns",Paul Mazursky,"['Paul Mazursky', 'Josh Greenfeld']","Harry est un enseignant retraité dans ses années 70 vivant dans l'Upper West Side de New York City où sa défunte épouse et il a élevé ses enfants - où il a vécu toute sa vie. Lorsque l'immeuble dans lequel il vit est détruit pour faire place à un garage de stationnement, Harry et son chat bien-aimé Tonto commencent un voyage à travers les États-Unis, visitent ses enfants, voyant un monde qu'il n'a jamais semblé avoir le temps de voir avant, se faisant de nouveaux amis, et disant au revoir à de vieux amis."
tt0071615,La montaña sagrada,1973,"Fantasy, Adventure, Drama",114,La montagne sacrée,7.7,49522,The Alchemist assembles together a group of people from all walks of life to represent the planets in the solar system. The occult adept's intention is to put his recruits through strange mystical rites and divest them of their worldly baggage before embarking on a trip to Lotus Island. There they ascend the Holy Mountain to displace the immortal gods who secretly rule the universe.,/bvuWgH7MGYHBBdNeZcFDDA8vjYY.jpg,MX,"Valerie Jodorowsky, Adriana Page, Burt Kleiner, Juan Ferrara, Horacio Salinas, Nicky Nichols, Richard Rutowski, Zamira Saunders, Luis Lomelí, Alejandro Jodorowsky",Alejandro Jodorowsky,['Alejandro Jodorowsky'],"L'Alchimiste rassemble un groupe de personnes de tous les horizons pour représenter les planètes du système solaire. L'intention de l'adepte occulte est de mettre ses recrues à travers des rites mystiques étranges et de les dessaisir de leurs bagages mondains avant d'embarquer sur un voyage à l'île de Lotus. Là, ils montent la Montagne Sainte pour déplacer les dieux immortels qui gouvernent secrètement l'univers."
tt0071622,L'horloger de Saint-Paul,1974,"Drama, Crime",105,L'horloger de Saint-Paul,7.1,2921,"Lyons, France. Michel Descombes is a watchmaker who lives alone with his teenage son Bernard. When the police visit and informs him that Bernard killed a man and is on the run with a girl, Michel realizes that he knew far less about his son than he thought .",/dmswSI4RZ27MmYQFr5SMddxGdKf.jpg,FR,"Jean Rochefort, Cécile Vassort, Andrée Tainsy, Jacques Denis, Philippe Noiret, Jacques Hilling, Clotilde Joano, Julien Bertheau, Yves Afonso, William Sabatier",Bertrand Tavernier,"['Bertrand Tavernier', 'Jean Aurenche', 'Georges Simenon', 'Pierre Bost']","Lyons, France. Michel Descombes est un horloger qui vit seul avec son fils adolescent Bernard. Quand la police le visite et l'informe que Bernard a tué un homme et est en fuite avec une fille, Michel se rend compte qu'il en savait beaucoup moins sur son fils qu'il ne le pensait."
tt0071691,Jeder für sich und Gott gegen alle,1974,"History, Biography, Drama",110,L'énigme de Kaspar Hauser,7.7,19283,"The film follows Kaspar Hauser (Bruno S.), who lived the first seventeen years of his life chained in a tiny cellar with only a toy horse to occupy his time, devoid of all human contact except for a man who wears a black overcoat and top hat who feeds him.",/z1rBBE8NWociDQClr8y6Onv1X62.jpg,DE,"Willy Semmelrogge, Walter Ladengast, Volker Prechtel, Brigitte Mira, Michael Kroecher, Henry van Lyck, Herbert Achternbusch, Bruno S., Gloria Doer, Hans Musäus",Werner Herzog,['Werner Herzog'],"Le film suit Kaspar Hauser (Bruno S.), qui a vécu les dix-sept premières années de sa vie enchaîné dans une minuscule cave avec seulement un cheval de jouet pour occuper son temps, dépourvu de tout contact humain, à l'exception d'un homme qui porte un manteau noir et un chapeau supérieur qui le nourrit."
tt0071695,Kozure Ôkami: Jigoku e ikuzo! Daigorô,1974,"Action, Adventure, Drama",83,Baby Cart: Le paradis blanc de l'enfer,7.3,4419,"In the sixth and final film of the Lone Wolf and Cub series, the final conflict between Ogami Itto and the Yagyu clan is carried out.",/zRBOXoQDvcApwVWyY80G813qzHd.jpg,JP,"Gorô Mutsumi, Jirô Miyaguchi, Teruo Ishiyama, Tomisaburô Wakayama, Gakuya Morita, Renji Ishibashi, Daigo Kusano, Chie Kobayashi, Akihiro Tomikawa, Junko Hitomi",Yoshiyuki Kuroda,"['Goseki Kojima', 'Kazuo Koike', 'Tsutomu Nakamura']","Dans le sixième et dernier film de la série Lone Wolf et Cub, le dernier conflit entre Ogami Itto et le clan Yagyu se déroule."
tt0071733,Lacombe Lucien,1974,"Drama, War",138,Lacombe Lucien,7.6,8012,"In Louis Malle's lauded drama, Lucien Lacombe is a young man living in rural France during World War II who seeks to join the French Resistance. When he is rejected due to his youth, the resentful Lucien allies himself with the Nazis and joins the Gallic arm of their Gestapo. Lucien grows to enjoy the power that comes with his position, but his life is complicated when he falls for France Horn, a beautiful young Jewish woman.",/gHlorDyJrigxzcuZaQ5p4mseAPC.jpg,"DE, FR, IT","Pierre Decazes, René Bouloc, Jean Rougerie, Pierre Blaise, Holger Löwenadler, Cécile Ricard, Therese Giehse, Loumi Iacobesco, Aurore Clément, Stéphane Bouy",Louis Malle,"['Patrick Modiano', 'Louis Malle']","Dans le drame de Louis Malle, Lucien Lacombe est un jeune homme vivant en France rurale pendant la Seconde Guerre mondiale qui cherche à rejoindre la Résistance française. Lorsqu'il est rejeté en raison de sa jeunesse, le vexant Lucien s'allie aux nazis et rejoint le bras gallois de leur Gestapo. Lucien grandit pour jouir du pouvoir qui vient avec sa position, mais sa vie est compliquée quand il tombe pour France Horn, une belle jeune juive."
tt0071746,Lenny,1974,"Biography, Drama",111,Lenny,7.5,18056,"The story of acerbic 1960s comic Lenny Bruce, whose groundbreaking, no-holds-barred style and social commentary was often deemed by the establishment as too obscene for the public.",/Avhk4pGdz3YQrzqLU65icjnE6vn.jpg,US,"Michele Yonge, Jan Miner, Guy Rennie, Dustin Hoffman, Rashel Novikoff, Stanley Beck, Valerie Perrine, Frankie Man, Gary Morton, Kathryn Witt",Bob Fosse,['Julian Barry'],"L'histoire de la bande dessinée acerbique des années 1960 Lenny Bruce, dont le style révolutionnaire et sans bornes et le commentaire social étaient souvent considérés par l'établissement comme trop obscènes pour le public."
tt0071771,The Longest Yard,1974,"Drama, Comedy, Crime",121,Plein la gueule,7.1,22024,"In this rough-and-tumble yarn, filmed on-location at the Georgia State Prison, the cons are the heroes and the guards are the heavies. Eddie Albert is the sadistic warden who'll gladly make any sacrifice to push his guards' semi-pro football team to a national championship.",/fejSpoFU4sq2g6n1JA2NY3KjRxW.jpg,US,"Burt Reynolds, Jim Nicholson, John Steadman, Mike Henry, James Hampton, Eddie Albert, Michael Conrad, Charles Tyner, Ed Lauter, Harry Caesar",Robert Aldrich,"['Albert S. Ruddy', 'Tracy Keenan Wynn']","Dans ce fil dur et douillet, filmé sur place à la prison d'État de Géorgie, les adversaires sont les héros et les gardiens sont les lourds. Eddie Albert est le gardien sadique qui fera volontiers tout sacrifice pour pousser son équipe de football semi-pro de ses gardes à un championnat national."
tt0071797,Mahler,1974,"Music, Biography, Drama",115,Mahler,7.0,3195,Famed composer Gustav Mahler reflects on the tragedies of his life and failing marriage while traveling by train.,/9wEOTpjm3yxhva4OFlVMiwuslTt.jpg,GB,"Gary Rich, Georgina Hale, Angela Down, Lee Montague, Antonia Ellis, Richard Morant, Miriam Karlin, Ronald Pickup, Rosalie Crutchley, Robert Powell",Ken Russell,['Ken Russell'],Le célèbre compositeur Gustav Mahler réfléchit aux tragédies de sa vie et à l'échec du mariage en voyageant en train.
tt0071840,Milano odia: la polizia non può sparare,1974,"Thriller, Drama, Crime",99,La rançon de la peur,7.2,3038,"A psychotic small-time criminal realizes that the everyday robberies, rapes and murders he commits aren't profitable enough, so he figures to hit the big time by kidnapping the daughter of a rich man.",/geAc9xON27Ppb8N6bJBitUn3Oru.jpg,IT,"Pippo Starnazza, Laura Belli, Joris Muzio, Rosita Torosh, Gino Santercole, Tomas Milian, Henry Silva, Lorenzo Piani, Mario Piave, Luciano Catenacci",Umberto Lenzi,['Ernesto Gastaldi'],"Un petit criminel psychotique s'aperçoit que les vols quotidiens, les viols et les meurtres qu'il commet ne sont pas assez rentables, alors il s'imagine qu'il frappera le grand moment en kidnappant la fille d'un homme riche."
tt0071853,Monty Python and the Holy Grail,1975,"Fantasy, Adventure, Comedy",91,Monty Python sacré graal!,8.2,580486,"King Arthur, accompanied by his squire, recruits his Knights of the Round Table, including Sir Bedevere the Wise, Sir Lancelot the Brave, Sir Robin the Not-Quite-So-Brave-As-Sir-Lancelot and Sir Galahad the Pure. On the way, Arthur battles the Black Knight who, despite having had all his limbs chopped off, insists he can still fight. They reach Camelot, but Arthur decides not  to enter, as ""it is a silly place"".",/xZ0rC0kuIsjk6RncpNK73kwstEP.jpg,GB,"John Cleese, Neil Innes, Eric Idle, Bee Duffell, Michael Palin, Terry Jones, Carol Cleveland, Terry Gilliam, Connie Booth, Graham Chapman","Terry Gilliam, Terry Jones","['John Cleese', 'Terry Gilliam', 'Eric Idle', 'Graham Chapman']","Le roi Arthur, accompagné de son écuyer, recrute ses Chevaliers de la Table Ronde, dont Sir Bedevere le Sage, Sir Lancelot le Brave, Sir Robin le Non-Quite-So-Brave-As-Sir-Lancelot et Sir Galahad le Pure. Sur le chemin, Arthur combat le Chevalier Noir qui, bien qu'ayant eu tous ses membres coupés, insiste qu'il peut encore se battre. Ils atteignent Camelot, mais Arthur décide de ne pas entrer, car « c'est un endroit stupide »."
tt0071859,Mossafer,1974,Drama,83,Le passager,7.5,2263,"Hassan Darabi, a troublesome, amoral 10-year-old boy in a small Iranian town wishes to see the Iran national football team play an important match in Tehran. In order to achieve that, he scams his friends and neighbors.",/fqt69D09JDTpuIwfXpH4TD5BRrL.jpg,IR,"Pare Gol Atashjameh, Goudarzi, Khanjani, Masud Zandbegleh, Kianian, Bayat, Mostafa Tari, Hasan Arab, Jafari, Hassan Darabi",Abbas Kiarostami,"[""Hassan Rafi'i"", 'Abbas Kiarostami']","Hassan Darabi, un jeune garçon de 10 ans embarrassant et amoral dans une petite ville iranienne, souhaite voir l'équipe nationale iranienne de football jouer un match important à Téhéran. Pour y parvenir, il arnaque ses amis et voisins."
tt0071877,Murder on the Orient Express,1974,"Mystery, Drama, Crime",128,Le crime de l'Orient-Express,7.2,70905,"In 1935, when his train is stopped by deep snow, detective Hercule Poirot is called on to solve a murder that occurred in his car the night before.",/6tHXXo9kciCKGp3kF0ffY9mjuOA.jpg,"US, GB","Jean-Pierre Cassel, John Gielgud, Lauren Bacall, Wendy Hiller, Sean Connery, Jacqueline Bisset, Albert Finney, Martin Balsam, Ingrid Bergman, Anthony Perkins",Sidney Lumet,"['Agatha Christie', 'Paul Dehn']","En 1935, lorsque son train est arrêté par la neige profonde, l'inspecteur Hercule Poirot est appelé à résoudre un meurtre qui s'est produit dans sa voiture la veille."
tt0071935,The ODESSA File,1974,"Drama, Thriller",130,Le dossier Odessa,7.0,12501,"After reading the diary of an elderly Jewish man who committed suicide, freelance journalist Peter Miller begins to investigate the alleged sighting of a former SS-Captain who commanded a concentration camp during World War II. Miller eventually finds himself involved with the powerful organisation of former SS members—called ODESSA—as well as with the Israeli secret service. Miller probes deeper and eventually discovers a link between the SS-Captain, ODESSA and his own family.",/j8uFsP2PxDMN3bdo5Ve6fYj0ebN.jpg,"DE, GB","Jon Voight, Klaus Löwitsch, Kurt Meisel, Derek Jacobi, Maria Schell, Garfield Morgan, Mary Tamm, Hannes Messemer, Maximilian Schell, Peter Jeffrey",Ronald Neame,"['Frederick Forsyth', 'Kenneth Ross', 'George Markstein']","Après avoir lu le journal d'un juif âgé qui s'est suicidé, le journaliste freelance Peter Miller commence à enquêter sur l'observation présumée d'un ancien capitaine SS qui a commandé un camp de concentration pendant la Seconde Guerre mondiale. Miller finit par s'impliquer dans la puissante organisation d'anciens membres SS – appelé ODESSA – ainsi que dans le service secret israélien. Miller sonde plus en profondeur et finit par découvrir un lien entre le capitaine SS, ODESSA et sa propre famille."
tt0071960,The Outfit,1973,"Thriller, Drama, Crime",103,Echec à l'organisation,7.0,5282,A two-bit criminal takes on the Mafia to avenge his brother's death. Earl Macklin is a small time criminal who is released from prison after an unsuccessful bank robbery only to discover that a pair of gunmen killed his brother.,/qDcSuyvNeiDa9C1ghenDTGygsIK.jpg,US,"Felice Orlandi, Robert Duvall, Richard Jaeckel, Robert Ryan, Marie Windsor, Joe Don Baker, Sheree North, Karen Black, Jane Greer, Timothy Carey",John Flynn,"['John Flynn', 'Donald E. Westlake']",Un criminel bibit prend la mafia pour venger la mort de son frère. Earl Macklin est un petit criminel qui est libéré de prison après un vol de banque infructueux seulement pour découvrir qu'une paire d'hommes armés a tué son frère.
