tconst,originalTitle,year,genres,runtime,localised_title,averageRating,numVotes,overview,poster_path,production_countries,Actors,Directors,Writers,overview_fr
tt0052698,Classe tous risques,1960,"Romance, Drama, Crime",103,Classe tous risques,7.5,4623,"On crowded Milan streets, two men execute a split-second payroll heist-in broad daylight-then begin a lightning-paced getaway, via every conveyance available. But after all, when a tough guy's returning to France (where he's been sentenced to death in absentia) after holing up in Italy for nearly a decade, he's got to have some startup money--particularly if he's going back with the wife and kids.",/uMiuUAlPwiWDKSgu4SoShpzvMR.jpg,"IT, FR","Simone Desmaison, Jean-Paul Belmondo, Evelyne Ker, Lino Ventura, Michel Ardan, Stan Krol, Sandra Milo, Betty Schneider, Michèle Méritz, Marcel Dalio",Claude Sautet,"['José Giovanni', 'Pascal Jardin', 'Claude Sautet']","Dans les rues surpeuplées de Milan, deux hommes font un braquage de salaire en deux secondes, puis commencent une escapade à la vitesse de l'éclair, via chaque moyen de transport disponible. Mais après tout, quand un gars dur revient en France (où il a été condamné à mort par contumace) après s'être envolé en Italie pendant près d'une décennie, il doit avoir de l'argent de démarrage, surtout s'il retourne avec sa femme et ses enfants."
tt0052784,El esqueleto de la señora Morales,1960,"Horror, Comedy, Crime",85,Le squelette de Madame Morales,7.7,2391,A taxidermist decides to murder his wife after having to put up with her after twenty years of hellish marriage.,/bWC7hLO1EOHYeK6zNiLT7jonVg4.jpg,MX,"Arturo de Córdova, Guillermo Orea, Antonio Bravo, Rosenda Monteros, Armando Arriola, Elda Peralta, Amparo Rivelles, Angelines Fernández, Luis Aragón, Mercedes Pascual",Rogelio A. González,"['Arthur Machen', 'Luis Alcoriza']",Un taxidermiste décide de tuer sa femme après avoir dû la supporter après vingt ans de mariage infernal.
tt0052832,The Fugitive Kind,1960,"Romance, Drama",119,L'Homme à la peau de serpent,7.1,7377,"Val Xavier, a drifter of obscure origins, arrives at a small town and gets a job in a store run by Lady Torrence. Her husband, Jabe M. Torrance, is dying of cancer. Val is pursued by Carol Cutere, the enigmatic local tramp-of-good-family.",/ta2ircBtQs8EZXe6QznCI5J6N3i.jpg,US,"Anna Magnani, Maureen Stapleton, Mary Perry, R.G. Armstrong, Joanne Woodward, Ben Yaffee, Victor Jory, Virgilia Chew, Joe Brown Jr., Marlon Brando",Sidney Lumet,"['Tennessee Williams', 'Meade Roberts']","Val Xavier, un vagabond d'origines obscures, arrive dans une petite ville et obtient un emploi dans un magasin dirigé par Lady Torrence. Son mari, Jabe M. Torrance, meurt du cancer. Val est poursuivi par Carol Cutere, l'énigmatique tramp-of-good-family locale."
tt0052961,Kapò,1960,"Drama, War",116,Kapò,7.6,2684,"Determined to survive at any price, Edith, a young Jewish woman deported to an extermination camp, manages to survive by accepting the role of kapo, a privileged prisoner whose mission is to ruthlessly guard other prisoners.",/lAd0NUnvTFkgcwbJmbx0sffn7Bk.jpg,"YU, IT, FR","Bruno Scipioni, Paola Pitagora, Gianni Garko, Graziella Galvani, Annabella Besi, Emmanuelle Riva, Laurent Terzieff, Eleonora Bellinzaghi, Susan Strasberg, Didi Perego",Gillo Pontecorvo,"['Franco Solinas', 'Gillo Pontecorvo']","Résolue à survivre à tout prix, Edith, une jeune juive déportée dans un camp d'extermination, parvient à survivre en acceptant le rôle de kapo, prisonnier privilégié dont la mission est de garder impitoyablement d'autres prisonniers."
tt0052997,The League of Gentlemen,1960,"Drama, Comedy, Crime",116,Hold-up à Londres,7.2,5436,"Involuntarily-retired Colonel Hyde recruits seven other dissatisfied ex-servicemen for a special project. Each of the men has a skeleton in the cupboard, is short of money, and is a service-trained expert in his field. The job is a bank robbery, and military discipline and planning are imposed by Hyde and second-in-command Race on the team, although civilian irritations do start getting in the way.",/6lJvpL5Z3qZxegmJHUpjGsWROtW.jpg,GB,"Terence Alexander, Jack Hawkins, Kieron Moore, Melissa Stribling, Robert Coote, Norman Bird, Bryan Forbes, Roger Livesey, Richard Attenborough, Nigel Patrick",Basil Dearden,"['Bryan Forbes', 'John Boland']","Le colonel Hyde, à sa retraite involontaire, recrute sept autres anciens militaires insatisfaits pour un projet spécial. Chacun d'eux a un squelette dans l'armoire, manque d'argent et est un expert formé au service dans son domaine. Le travail est un vol de banque, et la discipline militaire et la planification sont imposées par Hyde et la deuxième course du commandant de l'équipe, bien que les irritations civiles commencent à gêner le chemin."
tt0053106,Neotpravlennoye pismo,1960,"Adventure, Drama",96,La lettre inachevée,7.8,4418,"Four geologists are searching for diamonds in the wilderness of Siberia. After a long and tiresome journey they manage to find their luck and put the diamond mine on the map. The map must be delivered back to Moscow. But on the day of their departure a terrible forest fire wreaks havoc, and the geologists get trapped in the woods.",/5jtn00Lv0YjVvyQEj29o4UkRs1w.jpg,SU,"Innokentiy Smoktunovskiy, Tatyana Samoylova, Evgeniy Urbanskiy, Vasiliy Livanov, Galina Kozhakina, Boris Kozhukhov",Mikhail Kalatozov,"['Viktor Rozov', 'Valeri Osipov', 'Grigoriy Koltunov']","Quatre géologues sont à la recherche de diamants dans le désert de Sibérie. Après un long et fatigant voyage, ils parviennent à trouver leur chance et mettent la mine de diamants sur la carte. La carte doit être remise à Moscou. Mais le jour de leur départ, un terrible incendie de forêt ravage, et les géologues sont pris au piège dans les bois."
tt0053279,Le signe du lion,1962,Drama,103,Le signe du lion,7.2,2416,"An American in Paris lives by sponging off his working friends, and throws a party using borrowed money when his rich American aunt dies, believing firmly in his horoscope.",/b5jY3jyISYMY0ReGjqtbgaPq7dr.jpg,FR,"Gilbert Edard, Michèle Girardon, Jill Olivier, Stéphane Audran, Paul Crauchet, Sophie Perrault, Van Doude, Christian Alers, Jess Hahn, Paul Bisciglia",Éric Rohmer,"['Paul Gégauff', 'Éric Rohmer']","Un Américain à Paris vit en sillonnant ses amis de travail, et lance une fête utilisant de l'argent emprunté quand sa riche tante américaine meurt, croyant fermement en son horoscope."
tt0053459,Les yeux sans visage,1960,"Horror, Drama",90,Les yeux sans visage,7.6,36577,"Dr. Génessier is riddled with guilt after an accident that he caused disfigures the face of his daughter, the once beautiful Christiane, who outsiders believe is dead. Dr. Génessier, along with accomplice and laboratory assistant Louise, kidnaps young women and brings them to the Génessier mansion. After rendering his victims unconscious, Dr. Génessier removes their faces and attempts to graft them on to Christiane's.",/8y7Z9Gvcq52uOlJlUWyn2epGGRd.jpg,"IT, FR","Juliette Mayniel, Yvette Etiévant, Claude Brasseur, Béatrice Altariba, Alexandre Rignault, Edith Scob, Alida Valli, Michel Etcheverry, Pierre Brasseur, Charles Blavette",Georges Franju,"['Thomas Narcejac', 'Pierre Boileau', 'Claude Sautet', 'Jean Redon']","Le Dr Génessier est criblé de culpabilité après un accident qu'il a causé défigure le visage de sa fille, une fois belle Christiane, qui croit être morte. Le Dr Génessier, avec sa complice et son assistante de laboratoire Louise, kidnappe de jeunes femmes et les amène au manoir Génessier. Après avoir rendu ses victimes inconscientes, le Dr Génessier enlève leur visage et tente de les greffer chez Christiane."
tt0053472,À bout de souffle,1960,"Drama, Crime",90,À bout de souffle,7.7,89897,"A small-time thief steals a car and impulsively murders a motorcycle policeman. Wanted by the authorities, he attempts to persuade a girl to run away to Italy with him.",/9Wx0Wdn2EOqeCZU4SP6tlS3LOml.jpg,FR,"Jean-Paul Belmondo, Jean Domarchi, Daniel Boulanger, Richard Balducci, José Bénazéraf, Gérard Brach, Jean Seberg, Jean-Luc Godard, Philippe de Broca",Jean-Luc Godard,['François Truffaut'],"Un petit voleur vole une voiture et assassine impulsivement un policier de moto. Désiré par les autorités, il tente de persuader une fille de s'enfuir en Italie avec lui."
tt0053579,Akibiyori,1960,"Drama, Comedy",128,Fin d'automne,7.9,6334,"A woman and her daughter are each forced to contend with an increasing pressure to marry, particularly from three men who knew her late husband.",/zdcS3UvySOsQ1tZURtQi9ghueuG.jpg,JP,"Shinichirô Mikami, Kuniko Miyake, Nobuo Nakamura, Mariko Okada, Yôko Tsukasa, Setsuko Hara, Chishû Ryû, Keiji Sada, Shin Saburi, Miyuki Kuwano",Yasujirô Ozu,"['Yasujirô Ozu', 'Ton Satomi', 'Kôgo Noda']","Une femme et sa fille sont toutes deux obligées de faire face à une pression croissante pour se marier, en particulier de la part de trois hommes qui connaissaient son défunt mari."
tt0053604,The Apartment,1960,"Drama, Romance, Comedy",125,La garçonnière,8.3,203184,"Bud Baxter is a minor clerk in a huge New York insurance company, until he discovers a quick way to climb the corporate ladder. He lends out his apartment to the executives as a place to take their mistresses. Although he often has to deal with the aftermath of their visits, one night he's left with a major problem to solve.",/dmaRf8ROeSmg4duvFeMLq2ULnk3.jpg,US,"Hope Holiday, Jack Lemmon, Joan Shawlee, Jack Kruschen, Ray Walston, Johnny Seven, David Lewis, Shirley MacLaine, Naomi Stevens, Fred MacMurray",Billy Wilder,"['Billy Wilder', 'I.A.L. Diamond']","Bud Baxter est commis mineur dans une énorme compagnie d'assurance de New York, jusqu'à ce qu'il découvre un moyen rapide de grimper l'échelle de l'entreprise. Il prête son appartement aux cadres comme un endroit pour emmener leurs maîtresses. Bien qu'il doive souvent faire face à la suite de leurs visites, une nuit il a laissé un problème majeur à résoudre."
tt0053619,L'avventura,1960,"Romance, Drama, Mystery",144,L'aventure,7.7,33736,"Claudia and Anna join Anna's lover, Sandro, on a boat trip to a remote volcanic island. When Anna goes missing, a search is launched. In the meantime, Sandro and Claudia become involved in a romance despite Anna's disappearance, though the relationship suffers from guilt and tension.",/waQPqPYLouGJXDYGqXmpyLN4PLA.jpg,"IT, FR","Renzo Ricci, Esmeralda Ruspoli, Lelio Luttazzi, Giovanni Petrucci, Dominique Blanchar, James Addams, Dorothy De Poliolo, Gabriele Ferzetti, Monica Vitti, Lea Massari",Michelangelo Antonioni,"['Tonino Guerra', 'Elio Bartolini', 'Michelangelo Antonioni']","Claudia et Anna rejoignent l'amant d'Anna, Sandro, lors d'un voyage en bateau vers une île volcanique éloignée. Quand Anna disparaît, une recherche est lancée. Entre-temps, Sandro et Claudia s'impliquent dans une romance malgré la disparition d'Anna, bien que la relation souffre de culpabilité et de tension."
tt0053666,Les bonnes femmes,1960,"Romance, Drama, Mystery",100,Les bonnes femmes,7.2,3261,Four Parisian women navigate the world of romance and daily life looking to fulfill their dreams.,/lro6PSrHaO97BTWgJqYC47uvtba.jpg,"IT, FR","Albert Dinan, Sacha Briquet, Clotilde Joano, Claude Berri, Lucile Saint-Simon, Pierre Bertin, Bernadette Lafont, Jean-Louis Maury, Ave Ninchi, Stéphane Audran",Claude Chabrol,"['Claude Chabrol', 'Paul Gégauff']",Quatre Parisiennes naviguent dans le monde de la romance et de la vie quotidienne en quête de réaliser leurs rêves.
tt0053729,Comanche Station,1960,"Drama, Western",73,Comanche Station,7.0,4608,"A man saves a woman who had been kidnapped by Comanches, then struggles to get both of them home alive.",/1PHMKqoyZ4JS1iXBDSgKrbirox.jpg,US,"Rand Brooks, Skip Homeier, Richard Rust, Joe Molina, Nancy Gates, Dyke Johnson, P. Holland, Randolph Scott, Foster Hood, Claude Akins",Budd Boetticher,['Burt Kennedy'],"Un homme sauve une femme qui avait été kidnappée par Comanches, puis lutte pour qu'ils rentrent tous les deux vivants."
tt0053765,Devi,1960,Drama,93,La déesse,7.7,2934,The life of a woman happily married to the son of an upper-class family in 19th century Bengal is turned upside down when her father-in-law has a vision that she is the Goddess Kali returned to earth. He convinces her to fulfill her role as a living deity and transform her house into a temple.,/Uf7HhrqrGVFmI3Ec5w9skBDIqC.jpg,IN,"Khagesh Chakravarti, Arabinda Kumar Chowdhury, Sharmila Tagore, Arpan Chowdhury, Anil Chatterjee, Purnendu Mukherjee, Karuna Bannerjee, Anil Bag, Soumitra Chatterjee, Chhabi Biswas",Satyajit Ray,"['Satyajit Ray', 'Prabhat Kumar Mukherjee']",La vie d'une femme heureuse mariée au fils d'une famille de classe supérieure au 19ème siècle Bengale est renversée quand son beau-père a une vision qu'elle est la Déesse Kali retournée sur terre. Il la convainc d'accomplir son rôle de divinité vivante et de transformer sa maison en temple.
tt0053772,Djävulens öga,1960,"Fantasy, Drama, Comedy",87,L'Œil du diable,7.1,4705,"The devil has a stye in his eye, caused by the purity of a vicar's daughter. To get rid of it, he sends Don Juan up from hell to seduce the 20 year old Britt-Marie and to rob her of her virginity and her belief in love. She however can resist him and things get even turned around when Don Juan falls in love with her. The fact that he feels love for the first time now, makes him even less attractive to her and Don Juan returns to hell.",/njgS53DDdtsj5DXaGcEwglwq8z3.jpg,SE,"Georg Funkquist, Sture Lagerwall, Jarl Kulle, Stig Järrel, Gunnar Sjöberg, Torsten Winge, Axel Düberg, Bibi Andersson, Gertrud Fridh, Nils Poppe",Ingmar Bergman,['Ingmar Bergman'],"Pour s'en débarrasser, il envoie Don Juan de l'enfer pour séduire Britt-Marie, 20 ans, et lui voler sa virginité et sa croyance en l'amour. Elle peut cependant lui résister et les choses se retournent quand Don Juan tombe amoureux d'elle. Le fait qu'il ressent l'amour pour la première fois maintenant, le rend encore moins attrayant pour elle et Don Juan retourne en enfer."
tt0053779,La dolce vita,1960,"Drama, Comedy",174,La douceur de vivre,8.0,80341,"Journalist and man-about-town Marcello struggles to find his place in the world, torn between the allure of Rome's elite social scene and the stifling domesticity offered by his girlfriend, all the while searching for a way to become a serious writer.",/kZF1akNxeNJiCiMRWdF0fe0x48H.jpg,"IT, FR","Anouk Aimée, Marcello Mastroianni, Walter Santesso, Riccardo Garrone, Alain Cuny, Magali Noël, Valeria Ciangottini, Anita Ekberg, Yvonne Furneaux, Annibale Ninchi",Federico Fellini,"['Brunello Rondi', 'Tullio Pinelli', 'Federico Fellini', 'Ennio Flaiano']","Le journaliste et homme de la ville de Marcello lutte pour trouver sa place dans le monde, déchiré entre l'attrait de la scène sociale d'élite de Rome et la domesticité étouffante offerte par sa petite amie, tout en cherchant un moyen de devenir un écrivain sérieux."
tt0053793,Elmer Gantry,1960,Drama,146,"Elmer Gantry, le charlatan",7.7,13333,"When hedonistic but charming con man Elmer Gantry meets the beautiful Sister Sharon Falconer, a roadside revivalist, he feigns piousness to join her act as a passionate preacher. The two make a successful onstage pair, and their chemistry extends to romance. Both the show and their relationship are threatened, however, when one of Gantry's ex-lovers decides that she has a score to settle with the charismatic performer.",/5vd031r08rrfSMqtB9UarwqCUOz.jpg,US,"John McIntire, Jean Simmons, Burt Lancaster, Shirley Jones, Hugh Marlowe, Arthur Kennedy, Joe Maross, Edward Andrews, Patti Page, Dean Jagger",Richard Brooks,"['Sinclair Lewis', 'Richard Brooks']","Quand Elmer Gantry rencontre la belle sœur Sharon Falconer, une revivaliste du bord de la route, il feigne la piété de se joindre à son acte de prédicateur passionné. Les deux font une paire réussie sur scène, et leur chimie s'étend à la romance. Le spectacle et leur relation sont menacés, cependant, lorsque l'un des anciens amoureux de Gantry décide qu'elle a une note à régler avec l'interprète charismatique."
tt0053796,The Entertainer,1960,Drama,96,Le cabotin,7.1,3856,"Archie Rice, an old-time British vaudeville performer sinking into final defeat, schemes to stay in show business.",/s549IYn0XDUlFHJpOLIrWE1uYXv.jpg,GB,"Brenda de Banzie, Laurence Olivier, Shirley Anne Field, Daniel Massey, Albert Finney, Miriam Karlin, Thora Hird, Roger Livesey, Alan Bates, Joan Plowright",Tony Richardson,"['Nigel Kneale', 'John Osborne']","Archie Rice, un ancien interprète britannique de vaudeville qui s'enfonce dans la défaite finale, s'efforce de rester dans le show business."
tt0053917,Home from the Hill,1960,"Romance, Drama",150,Celui par qui le scandale arrive,7.4,3985,"Captain Wade Hunnicutt is the wealthiest and most powerful citizen in his Texan town; he is also a notorious womanizer, which has turned his wife Hannah against him. She has brought up their son Theron to be dependent upon her; but as he reaches adulthood, Hunnicutt insists on taking over his upbringing, initiating him in hunting and other masculine pursuits, under the watchful eye of Rafe, Hunnicutt's loyal employee. But Theron's new lifestyle leads him into a love-affair with a local girl, and thence to his learning things about his parents that were previously hidden from him.",/cE52KPgeJqDyaVu29OFGKqSDyET.jpg,US,"George Peppard, Ken Renard, George Hamilton, Eleanor Parker, Constance Ford, Anne Seymour, Everett Sloane, Ray Teal, Robert Mitchum, Luana Patten",Vincente Minnelli,"['Irving Ravetch', 'William Humphrey', 'Harriet Frank Jr.']","Le capitaine Wade Hunnicutt est le citoyen le plus riche et le plus puissant de sa ville de Texan; il est aussi une femme célèbre, qui a tourné sa femme Hannah contre lui. Elle a élevé leur fils Theron pour être dépendant d'elle; mais à mesure qu'il atteint l'âge adulte, Hunnicutt insiste pour prendre en charge son éducation, l'initiant à la chasse et à d'autres activités masculines, sous l'œil vigilant de Rafe, l'employé loyal de Hunnicutt. Mais le nouveau style de vie de Theron l'amène dans un amour-affair avec une fille locale, et de là à ses choses d'apprentissage sur ses parents qui étaient auparavant cachés de lui."
tt0053946,Inherit the Wind,1960,"History, Biography, Drama",128,Procès de singe,8.1,33580,"Schoolteacher Bertram Cates is arrested for teaching his students Darwin's theory of evolution. The case receives national attention and one of the newspaper reporters, E.K. Hornbeck, arranges to bring in renowned defense attorney and atheist Henry Drummond to defend Cates. The prosecutor, Matthew Brady is a former presidential candidate, famous evangelist, and old adversary of Drummond.",/7oaHcF0gCOt2lKaT2zajhajP0Zo.jpg,US,"Dick York, Donna Anderson, Philip Coolidge, Paul Hartman, Fredric March, Elliott Reid, Gene Kelly, Spencer Tracy, Claude Akins, Harry Morgan",Stanley Kramer,"['Jerome Lawrence', 'Robert E. Lee', 'Harold Jacob Smith', 'Nedrick Young']","L'enseignant Bertram Cates est arrêté pour avoir enseigné à ses élèves la théorie de l'évolution de Darwin. L'affaire reçoit l'attention nationale et l'un des journalistes de journaux, E.K. Hornbeck, prend des dispositions pour amener un avocat de la défense renommé et l'athée Henry Drummond pour défendre Cates. Le procureur, Matthew Brady est un ancien candidat à la présidence, célèbre évangéliste, et ancien adversaire de Drummond."
tt0053967,The Young One,1960,Drama,96,La jeune fille,7.4,3140,"A jazz musician seeks refuge from a lynch mob on a remote island, where he meets a hostile game warden and the young object of his attentions.",/vgqmNCe9PKibdGpdWuhA6Ozuso.jpg,"US, MX","Zachary Scott, Crahan Denton, Bernie Hamilton, Claudio Brook, Key Meersman",Luis Buñuel,"['Luis Buñuel', 'Peter Matthiessen', 'Hugo Butler']","Un musicien de jazz cherche refuge à une foule de lynches sur une île éloignée, où il rencontre un gardien de jeu hostile et le jeune objet de ses attentions."
tt0053976,Jungfrukällan,1960,Drama,89,La Source,8.0,32287,"Devout Christians Töre and Märeta send their only daughter, the virginal Karin, and their foster daughter, the unrepentant Ingeri, to deliver candles to a distant church. On their way through the woods, the girls encounter a group of savage goat herders who brutally rape and murder Karin as Ingeri remains hidden. When the killers unwittingly seek refuge in the farmhouse of Töre and Märeta, Töre plots a fitting revenge.",/z70YM3Y4pNYZATMhFMKonngaeMC.jpg,SE,"Gunnel Lindblom, Allan Edwall, Axel Slangus, Max von Sydow, Birgitta Valberg, Birgitta Pettersson, Ove Porath, Gudrun Brost, Tor Isedal, Axel Düberg",Ingmar Bergman,['Ulla Isaksson'],"Les chrétiens dévots Töre et Märeta envoient leur fille unique, le Karin virginal, et leur fille nourricière, l'Ingeri non repentant, pour livrer des bougies à une église lointaine. Sur leur chemin à travers les bois, les filles rencontrent un groupe de bergers de chèvre sauvage qui violent et assassinent Karin comme Ingeri reste caché. Lorsque les tueurs cherchent involontairement refuge dans la ferme de Töre et Märeta, Töre complote une vengeance appropriée."
tt0053987,Katok i skripka,1961,Drama,46,Le rouleau compresseur et le violon,7.4,7324,"Seven year old Sasha practices violin every day to satisfy the ambition of his parents. Already withdrawn as a result of his routines, Sasha quickly regains confidence when he accidentally meets and befriends worker Sergei, who works on a steamroller in their upscale Moscow neighborhood.",/rQILTYttUhFTy715d41SG50Xpfi.jpg,SU,"Igor Fomchenko, Aleksandr Ilin, Marina Adzhubei, Yuri Brusser, Zhenya Fedchenko, Vyacheslav Borisov, Gena Klyachkovsky, Natalya Arkhangelskaya, Marina Figner, Vladimir Zamanskiy",Andrei Tarkovsky,"['Andrey Konchalovskiy', 'Andrei Tarkovsky', 'S. Bakhmetyeva']","Sasha, âgé de sept ans, pratique le violon tous les jours pour satisfaire l'ambition de ses parents. Déjà retiré de sa routine, Sasha retrouve rapidement confiance lorsqu'il rencontre accidentellement Sergei, travailleur ami, qui travaille sur un rouleau à vapeur dans leur quartier haut de gamme de Moscou."
tt0054001,Komisario Palmun erehdys,1960,"Mystery, Comedy, Crime",109,Le mystère Rygseck,7.7,2149,A closed room mystery begins when an infamous tycoon is found dead in his bath tub. The famous police lieutenant Palmu is summoned to investigate.,/j2EsFx9o4WfjCyiBKB8iRjXGjmD.jpg,FI,"Leo Jokela, Leo Riuttu, Joel Rinne, Elina Pohjanpää, Matti Oravisto, Matti Ranin, Saara Ranin, Elina Salo, Leevi Kuuranne, Pentti Siimes",Matti Kassila,"['Matti Kassila', 'Mika Waltari']",Un mystère de chambre fermée commence quand un magnat infâme est retrouvé mort dans sa baignoire. Le célèbre lieutenant de police Palmu est convoqué pour enquêter.
tt0054042,Macario,1960,"Fantasy, Drama, Mystery",91,Macario,8.3,4614,"Poor, hungry peasant Macario longs for just one good meal on the Day of the Dead. After his wife cooks a turkey for him, he meets three apparitions, the Devil, God, and Death. Each asks him to share his turkey, but he refuses all except Death. In return, Death gives him a bottle of water which will heal any illness. Soon, Macario is more wealthy than the village doctor, which draws the attention of the feared Inquisition.",/xX9JGtsnXQAR7e1fWkr7zBuQUHN.jpg,MX,"Consuelo Frank, José Gálvez, Mario Alberto Rodríguez, Ignacio López Tarso, Eduardo Fajardo, Enrique Lucero, Celia Tejeda, José Luis Jiménez, José Dupeyrón, Pina Pellicer",Roberto Gavaldón,"['Roberto Gavaldón', 'Emilio Carballido', 'B. Traven']","Macario, pauvre paysan affamé, ne désire qu'un bon repas le jour des morts. Après que sa femme lui ait préparé une dinde, il rencontre trois apparitions, le Diable, Dieu et la Mort. Chacun lui demande de partager sa dinde, mais il refuse tout sauf la Mort. En retour, la Mort lui donne une bouteille d'eau qui guérira toute maladie. Bientôt, Macario est plus riche que le médecin du village, qui attire l'attention de l'inquisition redoutée."
tt0054047,The Magnificent Seven,1960,"Action, Adventure, Drama",128,Les 7 mercenaires,7.7,104861,An oppressed Mexican peasant village hires seven gunfighters to help defend their homes.,/e5ToxOyJwuZD4VOfI0qEn5uIjeJ.jpg,US,"Eli Wallach, Horst Buchholz, Jorge Martínez de Hoyos, Steve McQueen, Vladimir Sokoloff, Brad Dexter, James Coburn, Robert Vaughn, Yul Brynner, Charles Bronson",John Sturges,['William Roberts'],Un village paysan mexicain opprimé engage sept artilleurs pour aider à défendre leurs maisons.
tt0054067,La maschera del demonio,1960,Horror,87,Le masque du démon,7.1,18482,A vengeful witch and her fiendish servant return from the grave and begin a bloody campaign to possess the body of the witch's beautiful look-alike descendant. Only the girl's brother and a handsome doctor stand in her way.,/7W8uSI5jclTERrnDJXtm3pZfr4.jpg,IT,"Mario Passante, Enrico Olivieri, Tino Bianchi, John Richardson, Clara Bindi, Ivo Garrani, Antonio Pierfederici, Barbara Steele, Andrea Checchi, Arturo Dominici",Mario Bava,"['Mario Serandrei', 'George Higgins', 'Ennio De Concini', 'Nikolay Gogol']",Une sorcière vendeuse et sa servante folle reviennent de la tombe et commencent une campagne sanglante pour posséder le corps de la belle descendante de la sorcière. Seul le frère de la fille et un beau médecin se tiennent sur son chemin.
