tconst,originalTitle,year,genres,runtime,localised_title,averageRating,numVotes,overview,poster_path,production_countries,Actors,Directors,Writers,overview_fr
tt0058461,Per un pugno di dollari,1964,"Drama, Western",99,Pour une poignée de dollars,7.9,239296,"The Man With No Name enters the Mexican village of San Miguel in the midst of a power struggle among the three Rojo brothers and sheriff John Baxter. When a regiment of Mexican soldiers bearing gold intended to pay for new weapons is waylaid by the Rojo brothers, the stranger inserts himself into the middle of the long-simmering battle, selling false information to both sides for his own benefit.",/lBwOEpwVeUAmrmglcstnaGcJq3Y.jpg,"ES, DE, IT","Wolfgang Lukschy, José Calvo, Daniel Martín, Marianne Koch, Sieghardt Rupp, Margarita Lozano, Gian Maria Volontè, Antonio Prieto, Joseph Egger, Clint Eastwood",Sergio Leone,"['Adriano Bolzoni', 'Víctor Andrés Catena', 'Sergio Leone', 'Mark Lowell']","L'homme sans nom entre dans le village mexicain de San Miguel au milieu d'une lutte de pouvoir entre les trois frères Rojo et le shérif John Baxter. Quand un régiment de soldats mexicains portant de l'or destiné à payer pour de nouvelles armes est waylaid par les frères Rojo, l'étranger s'insère dans le milieu de la longue bataille, vendant de fausses informations aux deux côtés pour son propre bénéfice."
tt0058500,The Pumpkin Eater,1964,Drama,118,Le mangeur de citrouilles,7.1,3058,"Jo, the mother of seven children, divorces her second husband in order to marry Jake, a successful but promiscuous screenwriter. Though they are physically and emotionally compatible, they are slowly torn apart.",/lMsnpQ0Bcm63uLDXYlTkLnkw0sR.jpg,GB,"Rosalind Atkinson, James Mason, Peter Finch, Janine Gray, Richard Johnson, Eric Porter, Alan Webb, Anne Bancroft, Maggie Smith, Cedric Hardwicke",Jack Clayton,"['Harold Pinter', 'Penelope Mortimer']","Jo, la mère de sept enfants, divorce de son second mari afin d'épouser Jake, scénariste réussi mais promiscieux. Bien qu'ils soient physiquement et émotionnellement compatibles, ils sont lentement déchirés."
tt0058557,Seance on a Wet Afternoon,1964,"Drama, Crime",115,Le rideau de brume,7.6,7656,"Working-class British housewife Myra Savage reinvents herself as a medium, holding seances in the sitting room of her home with the hidden assistance of her under-employed, asthmatic husband, Billy. In an attempt to enhance her credibility as a psychic, Myra hatches an elaborate, ill-conceived plot to kidnap a wealthy couple's young daughter so that she can then help the police ""find"" the missing girl.",/dHu7nuNwXTXoPdpNOEPKhHfCBk5.jpg,GB,"Godfrey James, Lionel Gamlin, Ronald Hines, Maria Kazan, Margaret Lacey, Marian Spencer, Marie Burke, Judith Donner, Richard Attenborough, Kim Stanley",Bryan Forbes,"['Mark McShane', 'Bryan Forbes']","Myra Savage, femme au foyer britannique de classe ouvrière, se réinvente comme médium, tenant des seances dans le salon de sa maison avec l'aide cachée de son mari asthmatique, sous-employé. Dans une tentative de renforcer sa crédibilité en tant que médium, Myra éclos un complot élaboré et mal pensé pour enlever la jeune fille d'un couple riche afin qu'elle puisse ensuite aider la police à « trouver » la fille disparue."
tt0058564,Sedotta e abbandonata,1964,"Drama, Comedy",115,Séduite et abandonnée,7.9,4008,"The film presents the tale of Agnese Ascalone, daughter of prominent miner Vincenzo Ascalone, and takes place in a small town in Sicily. Agnese is seduced by her sister Matilde's fiance, and has a tryst with him for which she confesses and tries to repent, only to be discovered by her mother and father. The film is a dark satire of Sicilian social customs and honor laws, and is very similar to Divorce, Italian Style.",/qexsWOAxpuwGgzhnIoNPSwD8pa7.jpg,"FR, IT","Paola Biggio, Aldo Puglisi, Oreste Palella, Leopoldo Trieste, Rocco DAssunta, Lola Braccini, Lando Buzzanca, Stefania Sandrelli, Saro Urzì, Umberto Spadaro",Pietro Germi,"['Luciano Vincenzoni', 'Agenore Incrocci', 'Pietro Germi', 'Furio Scarpelli']","Le film présente l'histoire d'Agnèse Ascalone, fille d'un éminent mineur Vincenzo Ascalone, et a lieu dans une petite ville de Sicile. Agnese est séduite par le fiancé de sa sœur Matilde, et a une tentative avec lui pour laquelle elle confesse et tente de se repentir, seulement pour être découvert par sa mère et son père. Le film est une satire sombre des coutumes sociales siciliennes et des lois d'honneur, et est très similaire au divorce, style italien."
tt0058567,6 donne per l'assassino,1964,"Horror, Drama, Crime",88,Six femmes pour l'assassin,7.1,13815,"Isabella, a young model, is murdered by a mysterious masked figure at a fashion house in Rome. When her diary, which details the house employees many vices, disappears, the masked killer begins killing off all the models in and around the house to find it.",/siEti5iNAbN91Q3AR2XRPfJ1E6O.jpg,"DE, FR, IT","Arianna Gorini, Franco Ressel, Lea Lander, Mary Arden, Dante DiPaolo, Luciano Pigozzi, Claude Dantes, Eva Bartok, Thomas Reiner, Cameron Mitchell",Mario Bava,"['Giuseppe Barilla', 'Marcello Fondato', 'Mario Bava', 'Mary Arden']","Isabella, une jeune mannequin, est assassinée par une mystérieuse figure masquée dans une maison de mode à Rome. Quand son journal, qui détaille les employés de la maison de nombreux vices, disparaît, le tueur masqué commence à tuer tous les mannequins à l'intérieur et autour de la maison pour la trouver."
tt0058576,Seven Days in May,1964,"Drama, Thriller",118,Sept jours en mai,7.8,17830,A U.S. Army colonel alerts the president of a planned military coup against him.,/fgMwyNl7uZeUrnIAqlX7htSQ2O2.jpg,US,"Whit Bissell, Fredric March, Kirk Douglas, Edmond OBrien, Burt Lancaster, Martin Balsam, Hugh Marlowe, Ava Gardner, Helen Kleeb, Andrew Duggan",John Frankenheimer,"['Charles W. Bailey II', 'Rod Serling', 'Fletcher Knebel']",Un colonel de l'armée américaine alerte le président d'un coup d'État militaire prévu contre lui.
tt0058586,A Shot in the Dark,1964,"Mystery, Comedy, Crime",102,Quand l'inspecteur s'emmêle,7.3,31839,"When rich Mr. Benjamin Ballon's Spanish driver is found shot dead, Inspector Jacques Clouseau is the first official on the scene. All evidence suggests Maria Gambrelli, the maid, to be the murderer. But Clouseau, being attracted to the beautiful girl, is convinced that she is hiding something. So, he has her released from jail and secretly tries to follow her. Things do not work out the way the inspector wants and people keep ending up murdered, and every time, innocent Maria seems to be the killer. But with someone important wanting Clouseau and nobody else to cover this case, his tolerance-challenged boss Charles Dreyfuss is close to losing his mind when casualties keep turning up. And Clouseau keeps on causing trouble without knowing it...",/pR6tNqNLYIbRRYC5TFKWVWaVvvK.jpg,"US, GB","George Sanders, Ann Lynn, Graham Stark, Moira Redmond, Elke Sommer, Herbert Lom, Vanda Godsell, Maurice Kaufmann, Peter Sellers, Tracy Reed",Blake Edwards,"['Harry Kurnitz', 'Marcel Achard', 'William Peter Blatty', 'Blake Edwards']","Quand le riche chauffeur espagnol de M. Benjamin Ballon est retrouvé mort, l'inspecteur Jacques Clouseau est le premier officiel sur les lieux. Toutes les preuves suggèrent Maria Gambrelli, la bonne, pour être le meurtrier. Mais Clouseau, étant attiré par la belle fille, est convaincu qu'elle cache quelque chose. Donc, il l'a libérée de prison et tente secrètement de la suivre. Les choses ne fonctionnent pas comme l'inspecteur veut et les gens finissent toujours par assassiner, et chaque fois, l'innocente Maria semble être le tueur. Mais avec quelqu'un d'important voulant Clouseau et personne d'autre pour couvrir cette affaire, son chef de tolérance contesté Charles Dreyfuss est proche de perdre l'esprit quand les victimes continuent de se lever. Et Clouseau continue à causer des ennuis sans le savoir..."
tt0058604,Soy Cuba,1964,Drama,141,Je suis Cuba,8.2,11175,Four vignettes about the lives of the Cuban people set during the pre-revolutionary era.,/yjkqAhn3hdO7PIO1Cf9eMUAczOk.jpg,"CU, SU","José Gallardo, Sergio Corrieri, Jean Bouise, Raúl García, Salvador Wood, Alberto Morgan, Zilia Rodriguez, Luz María Collazo, Roberto García York, Fausto Mirabal",Mikhail Kalatozov,"['Yevgeniy Yevtushenko', 'Enrique Pineda Barnet']",Quatre vignettes sur la vie du peuple cubain à l'époque pré-révolutionnaire.
tt0058625,Suna no onna,1964,"Drama, Thriller",147,La Femme des dunes,8.4,23594,An entomologist suffers extreme psychological and sexual torture after being taken captive by the residents of a poor seaside village.,/f0JpsMQ9oEjKBD66Ky3qK3z7LGT.jpg,JP,"Eiji Okada, Kiyohiko Ichihara, Sen Yano, Hiroyuki Nishimoto, Ginzô Sekiguchi, Hideo Kanze, Kôji Mitsui, Robert Dunham, Kyôko Kishida, Hiroko Itô",Hiroshi Teshigahara,"['Eiko Yoshida', 'Kôbô Abe']",Un entomologiste subit des tortures psychologiques et sexuelles extrêmes après avoir été emmené captif par les habitants d'un pauvre village de bord de mer.
tt0058642,Tini zabutykh predkiv,1965,"Romance, Drama",97,Les chevaux de feu,7.8,8841,"In a Carpathian village, Ivan falls in love with Marichka, the daughter of his father's killer. When tragedy befalls her, his grief lasts months; finally he rejoins the colorful life around him, marrying Palagna. She wants children but his mind stays on his lost love. To recapture his attention, Palagna tries sorcery, and in the process comes under the spell of the sorcerer, publicly humiliating Ivan, who then fights the sorcerer. The lively rhythms of village life, the work and the holidays, the pageant and revelry of weddings and funerals, the change of seasons, and nature's beauty give proportion to Ivan's tragedy.",/9oSZTeejmx80tIBVSqYzJpFhjkI.jpg,SU,"Aleksandr Raydanov, Nikolay Grinko, Nina Alisova, Larisa Kadochnikova, Neonila Gnepovskaya, Aleksandr Gai, Leonid Yengibarov, Spartak Bagashvili, Tatyana Bestayeva, Ivan Mikolaychuk",Sergei Parajanov,"['Ivan Chendej', 'Mikhail Kotsiubinsky', 'Sergei Parajanov']","Dans un village carpatien, Ivan tombe amoureux de Marichka, la fille du tueur de son père. Quand la tragédie lui arrive, son chagrin dure des mois; enfin, il rejoint la vie colorée autour de lui, épousant Palagna. Elle veut des enfants mais son esprit reste sur son amour perdu. Pour reprendre son attention, Palagna tente la sorcellerie, et dans le processus vient sous le sort du sorcier, publiquement humiliant Ivan, qui combat alors le sorcelier. Les rythmes animés de la vie de village, le travail et les vacances, le concours et le dépeuplement des mariages et des funérailles, le changement des saisons, et la beauté de la nature donnent une proportion à la tragédie d'Ivan."
tt0058652,Sanbiki no samurai,1964,"Action, Drama",94,Trois Samouraïs hors-la-loi,7.6,4120,"Shiba, a wandering ronin, encounters a band of peasants who have kidnapped the daughter of their dictatorial magistrate, in hopes of coercing from him a reduction in taxes. Shiba takes up their fight, joined by two renegades from the magistrate's guard, Sakura and Kikyo. The three outlaws find themselves in a battle to the death.",/tLMiKmFpIFPkTwxwi18hxxd2Q8r.jpg,JP,"Isamu Nagato, Mikijirô Hira, Hisashi Igawa, Yoshiko Kayama, Kamatari Fujiwara, Ichirô Izawa, Tetsurô Tanba, Tatsuya Ishiguro, Kyôko Aoi, Miyuki Kuwano",Hideo Gosha,"['Hideo Gosha', 'Eizaburô Shiba', 'Keiichi Abe']","Shiba, un ronin errant, rencontre une bande de paysans qui ont kidnappé la fille de leur magistrat dictatorial, dans l'espoir de lui imposer une réduction des impôts. Shiba reprend leur combat, rejoint par deux renégats de la garde du magistrat, Sakura et Kikyo. Les trois hors-la-loi se retrouvent dans une bataille à mort."
tt0058701,Une femme mariée: Suite de fragments d'un film tourné en 1964,1964,"Romance, Drama",94,Une femme mariée,7.1,4488,"In an exploration of love and adultery, a woman is conflicted between her husband, her lover and herself.",/s3IKTtCCcaD3dAv7Uiqtd1PFQIR.jpg,FR,"Rita Maiden, Philippe Leroy, Bernard Noël, Macha Méril, Véronique Duval, Christophe Bourseiller, Margareth Clémenti, Jean-Luc Godard, Georges Liron",Jean-Luc Godard,['Jean-Luc Godard'],"Dans une exploration de l'amour et de l'adultère, une femme est en conflit entre son mari, son amant et elle-même."
tt0058715,Il vangelo secondo Matteo,1964,"History, Biography, Drama",137,L'Évangile selon saint Matthieu,7.6,14052,"This biblical drama from the Catholic Marxist director focuses on the teachings of Jesus, including the parables that reflect their revolutionary nature. As Jesus travels along the coast of the Sea of Galilee, he gradually gathers more followers, leading him into direct conflict with the authorities.",/oifi2CQkKbb6Y2x6J5K6CjaKab9.jpg,"FR, IT","Giacomo Morante, Marcello Morante, Mario Socrate, Luigi Barbini, Margherita Caruso, Giorgio Agamben, Settimio Di Porto, Alfonso Gatto, Susanna Pasolini, Enrique Irazoqui",Pier Paolo Pasolini,['Pier Paolo Pasolini'],"Ce drame biblique du directeur marxiste catholique se concentre sur les enseignements de Jésus, y compris les paraboles qui reflètent leur nature révolutionnaire. Alors que Jésus voyage le long de la côte de la mer de Galilée, il rassemble progressivement plus de disciples, le conduisant dans un conflit direct avec les autorités."
tt0058724,The Visit,1964,Drama,100,La visite,7.4,2055,"Carla Zachanassian had a child by Serge Miller as a teenager. When Serge refused to marry her, she was driven out of town. By her own wit and cunning, she has returned as a multi-millionaire for a visit. The town lays out the red carpet expecting big things from Carla, only to learn that her sole purpose is to see Serge Miller killed...",/6FYP0V7asgRQwSFeZKUzNozQbp6.jpg,"US, DE, FR, IT","Leonard Steckel, Hans Christian Blech, Ingrid Bergman, Jacques Dufilho, Anthony Quinn, Paolo Stoppa, Richard Münch, Claude Dauphin, Ernst Schröder, Romolo Valli",Bernhard Wicki,"['Friedrich Dürrenmatt', 'Maurice Valency', 'Ben Barzman']","Carla Zachanassian a eu un enfant de Serge Miller en tant qu'adolescente. Quand Serge a refusé de l'épouser, elle a été chassée de la ville. Par son esprit et sa ruse, elle est revenue comme multimillionnaire pour une visite. La ville pose le tapis rouge en attendant de grandes choses de Carla, seulement pour apprendre que son seul but est de voir Serge Miller tué..."
tt0058777,Zulu,1964,"History, Drama, War",138,Zoulou,7.7,43773,"In 1879, during the Anglo-Zulu War, man-of-the-people Lt. Chard and snooty Lt. Bromhead are in charge of defending the isolated and vastly outnumbered Natal outpost of Rorke's Drift from tribal hordes.",/9V7tl1kIb67ZPRRNlUdy3JvqEiA.jpg,"GB, ZA","Jack Hawkins, Stanley Baker, Nigel Green, Michael Caine, Ulla Jacobsson, Glynn Edwards, James Booth, Ivor Emmanuel, Neil McCarthy, Paul Daneman",Cy Endfield,"['Cy Endfield', 'John Prebble']","En 1879, pendant la guerre anglo-zoulou, le Lt. Card et le Lt. Bromhead sont chargés de défendre l'avant-poste du Natal de Rorke, isolé et largement surpassé, des hordes tribales."
tt0058886,The Agony and the Ecstasy,1965,"History, Biography, Drama",138,L'extase et l'agonie,7.2,8286,"During the Italian Renaissance, Pope Julius II contracts the influential artist Michelangelo to sculpt 40 statues for his tomb. When the pope changes his mind and asks the sculptor to paint a mural in the Sistine Chapel, Michelangelo doubts his painting skills and abandons the project. Divine inspiration returns Michelangelo to the mural, but his artistic vision clashes with the pope's demanding personality and threatens the success of the historic painting.",/4ZiwyXtyxYDmMnNiVemCPgxY8X6.jpg,"US, IT","Charlton Heston, Alberto Lupo, Fausto Tozzi, Venantino Venantini, Maxine Audley, Adolfo Celi, Rex Harrison, John Stacy, Harry Andrews, Diane Cilento",Carol Reed,"['Philip Dunne', 'Irving Stone']","Pendant la Renaissance italienne, le pape Jules II engage l'artiste influent Michelangelo à sculpter 40 statues pour sa tombe. Lorsque le pape change d'avis et demande au sculpteur de peindre une murale dans la chapelle Sixtine, Michelangelo doute de ses compétences de peinture et abandonne le projet. L'inspiration divine renvoie Michelangelo à la murale, mais sa vision artistique s'oppose à la personnalité exigeante du pape et menace le succès de la peinture historique."
tt0058888,Akahige,1965,Drama,185,Barberousse,8.3,21838,"Aspiring to an easy job as personal physician to a wealthy family, Noboru Yasumoto is disappointed when his first post after medical school takes him to a small country clinic under the gruff doctor Red Beard. Yasumoto rebels in numerous ways, but Red Beard proves a wise and patient teacher. He gradually introduces his student to the unglamorous side of the profession, ultimately assigning him to care for a prostitute rescued from a local brothel.",/fo800fRcWtl3Zhs6tPHfXP4KBak.jpg,JP,"Terumi Niki, Yoshitaka Zushi, Yûzô Kayama, Kyôko Kagawa, Reiko Dan, Tsutomu Yamazaki, Toshirô Mifune, Akemi Negishi, Miyuki Kuwano, Tatsuyoshi Ehara",Akira Kurosawa,"['Hideo Oguni', 'Masato Ide', 'Ryûzô Kikushima', 'Akira Kurosawa']","Aspirant à un travail facile en tant que médecin personnel pour une famille riche, Noboru Yasumoto est déçu quand son premier poste après l'école de médecine l'emmène dans une petite clinique de pays sous le Dr Red Beard. Yasumoto rebelles de nombreuses manières, mais Red Beard se révèle un professeur sage et patient. Il introduit progressivement son élève au côté non-glamour de la profession, l'affectant finalement à s'occuper d'une prostituée sauvée d'un bordel local."
tt0058898,Alphaville: Une étrange aventure de Lemmy Caution,1965,"Sci-Fi, Drama, Mystery",99,Alphaville,7.0,28536,"An American private-eye arrives in Alphaville, a futuristic city on another planet which is ruled by an evil scientist named Von Braun, who has outlawed love and self-expression.",/fFJP3D5fJDFxN7ChqSye1DZ0fTL.jpg,"FR, IT","Akim Tamiroff, Jean-Louis Comolli, Valérie Boisgel, Jean-André Fieschi, Eddie Constantine, Anna Karina, László Szabó, Michel Delahaye, Jean-Pierre Léaud, Christa Lang",Jean-Luc Godard,['Jean-Luc Godard'],"Un œil privé américain arrive à Alphaville, une ville futuriste sur une autre planète qui est gouvernée par un scientifique maléfique nommé Von Braun, qui a interdit l'amour et l'expression de soi."
tt0058946,La battaglia di Algeri,1966,"Drama, War",121,La Bataille d'Alger,8.1,68207,Tracing the struggle of the Algerian Front de Liberation Nationale to gain freedom from French colonial rule as seen through the eyes of Ali from his start as a petty thief to his rise to prominence in the organisation and capture by the French in 1957. The film traces the rebels' struggle and the increasingly extreme measures taken by the French government to quell the revolt.,/1eEN4ubAFB4N2Rl9syqPVCcwrGG.jpg,"DZ, IT","Mohamed Ben Kassen, Jean Martin, Brahim Hadjadj, Franco Moruzzi, Samia Kerbash, Yacef Saadi, Ugo Paletti, Rouiched, Fouzia El Kader, Tommaso Neri",Gillo Pontecorvo,"['Franco Solinas', 'Gillo Pontecorvo']",Tracer la lutte du Front de libération national algérien pour obtenir la liberté de la domination coloniale française telle qu'elle ressort des yeux d'Ali depuis son départ comme petit voleur jusqu'à sa montée en importance dans l'organisation et la capture par les Français en 1957. Le film retrace la lutte des rebelles et les mesures de plus en plus extrêmes prises par le gouvernement français pour étouffer la révolte.
tt0058962,The Bedford Incident,1965,"Drama, Thriller",102,Aux postes de combat,7.3,6134,"During a routine patrol, a reporter is given permission to interview a hardened cold-war warrior and captain of the American destroyer USS Bedford. The reporter gets more than he bargained for when the Bedford discovers a Soviet sub and the captain begins a relentless pursuit, pushing his crew to breaking point.",/rRs46zijLxcXQ3MXu1UwU3dz8GU.jpg,"US, GB","Wally Cox, Colin Maitland, James MacArthur, Paul Tamarin, Martin Balsam, Eric Portman, Richard Widmark, Michael Kane, Sidney Poitier, Frank Lieberman",James B. Harris,"['Mark Rascovich', 'James Poe']","Au cours d'une patrouille de routine, un reporter est autorisé à interviewer un guerrier de guerre froide endurci et capitaine du destroyer américain USS Bedford. Le reporter obtient plus que ce qu'il a négocié pour quand le Bedford découvre un sous-marin soviétique et le capitaine commence une poursuite implacable, poussant son équipage au point de rupture."
tt0058985,Le bonheur,1965,"Romance, Drama",80,Le bonheur,7.6,10155,"A young husband and father, perfectly content with his life, falls in love with another woman.",/r6UYog9MruOe4X71AS57EhuJrFq.jpg,FR,"Marcelle Faure-Bertin, Sylvia Saurel, Christian Riehl, Olivier Drouot, Claire Drouot, Marc Eyraud, Jean-Claude Drouot, Marie-France Boyer, Manon Lanclos, Sandrine Drouot",Agnès Varda,['Agnès Varda'],"Un jeune mari et père, parfaitement content de sa vie, tombe amoureux d'une autre femme."
tt0058997,Bunny Lake Is Missing,1965,"Thriller, Drama, Mystery",107,Bunny Lake a disparu,7.3,10595,"A woman reports that her young daughter is missing, but there seems to be no evidence that she ever existed.",/zsZ2PAMMyBhkn5OSC8Qnror2KCA.jpg,GB,"Keir Dullea, Laurence Olivier, Finlay Currie, The Zombies, Lucie Mannheim, Martita Hunt, Anna Massey, Carol Lynley, Noël Coward, Clive Revill",Otto Preminger,"['Marryam Modell', 'John Mortimer', 'Penelope Mortimer']","Une femme signale que sa jeune fille a disparu, mais il ne semble pas qu'elle ait jamais existé."
tt0059012,Campanadas a medianoche,1965,"History, Drama, Comedy",115,Falstaff,7.6,10466,"The culmination of Orson Welles’s lifelong obsession with Shakespeare’s robustly funny and ultimately tragic antihero, Sir John Falstaff; the often soused friend of King Henry IV’s wayward son Prince Hal. Integrating elements from both Henry IV plays as well as Richard II, Henry V, and The Merry Wives of Windsor.",/5Fjxyz3u2Zdco4WeuC3wQ6O5tYQ.jpg,"ES, CH","John Gielgud, Andrés Mejuto, Marina Vlady, Jeanne Moreau, Tony Beckley, Julio Peña, Margaret Rutherford, Orson Welles, Michael Aldridge, Walter Chiari",Orson Welles,"['William Shakespeare', 'Raphael Holinshed']","L'aboutissement de l'obsession d'Orson Welles pour la vie avec Shakespeares fort drôle et finalement tragique anti-héros, sir John Falstaff; l'ami souvent soulagé du roi Henry IV. Son fils wayward Prince Hal. Intégrer des éléments de Henry IV pièces ainsi que Richard II, Henry V, et The Merry Wives de Windsor."
tt0059037,The Cincinnati Kid,1965,Drama,102,Le Kid de Cincinnati,7.2,18681,An up-and-coming poker player tries to prove himself in a high-stakes match against a long-time master of the game.,/s4Apy8FcF6a0lR1Qay1atpfwAv9.jpg,US,"Rip Torn, Jack Weston, Edward G. Robinson, Tuesday Weld, Steve McQueen, Ann-Margret, Cab Calloway, Joan Blondell, Karl Malden, Jeff Corey",Norman Jewison,"['Ring Lardner Jr.', 'Terry Southern', 'Richard Jessup']",Un joueur de poker à venir essaie de se prouver dans un match de haut niveau contre un maître de longue date du jeu.
tt0059043,The Collector,1965,"Drama, Thriller",119,L'obsédé,7.5,12280,"Freddie is an inept bank clerk with no future. His only hobby is collecting butterflies, which gives him a feeling of power and control that is otherwise totally missing from his life. He comes into a large sum of money and buys himself a country house. Still unable to make himself at ease socially, he starts to plan on acquiring a girlfriend - in the same manner as he collects butterflies. He prepares the cellar of the house to be a collecting jar and stalks his victim over several days.",/noTdaoKdVfc3wO2RxsgljVPTLzX.jpg,"US, GB","Terence Stamp, Allyson Ames, Kenneth More, William Beckley, Maurice Dallimore, Mona Washbourne, William Bickley, David Haviland, Gordon Barclay, Samantha Eggar",William Wyler,"['John Fowles', 'Stanley Mann', 'John Kohn']","Freddie est un employé de banque inepte sans avenir. Son seul passe-temps est la collecte de papillons, ce qui lui donne un sentiment de pouvoir et de contrôle qui est autrement totalement absent de sa vie. Il vient dans une grande somme d'argent et s'achète une maison de campagne. Toujours incapable de se rendre à l'aise socialement, il commence à planifier d'acquérir une petite amie - de la même manière qu'il recueille des papillons. Il prépare la cave de la maison pour être un pot de collecte et traque sa victime pendant plusieurs jours."
